root@comp3134-intro:~# tcpdump -i eth0 port 22
tcpdump: verbose output suppressed, use -v or -vv for full protocol decode
listening on eth0, link-type EN10MB (Ethernet), capture size 262144 bytes
01:44:53.430338 IP comp3134-intro.ssh > cpe688f2e0f3fd3-cm688f2e0f3fd0.cpe.net.fido.ca.50292: Flags [P.], seq 2420277715:2420277751, ack 1407557169, win 1567, options [nop,nop,TS val 2498874256 ecr 1228193013], length 36
01:44:53.431601 IP comp3134-intro.ssh > cpe688f2e0f3fd3-cm688f2e0f3fd0.cpe.net.fido.ca.50292: Flags [P.], seq 36:144, ack 1, win 1567, options [nop,nop,TS val 2498874257 ecr 1228193013], length 108
01:44:53.431658 IP comp3134-intro.ssh > cpe688f2e0f3fd3-cm688f2e0f3fd0.cpe.net.fido.ca.50292: Flags [P.], seq 144:180, ack 1, win 1567, options [nop,nop,TS val 2498874257 ecr 1228193013], length 36
01:44:53.431714 IP comp3134-intro.ssh > cpe688f2e0f3fd3-cm688f2e0f3fd0.cpe.net.fido.ca.50292: Flags [P.], seq 180:288, ack 1, win 1567, options [nop,nop,TS val 2498874257 ecr 1228193013], length 108
01:44:53.431760 IP comp3134-intro.ssh > cpe688f2e0f3fd3-cm688f2e0f3fd0.cpe.net.fido.ca.50292: Flags [P.], seq 288:324, ack 1, win 1567, options [nop,nop,TS val 2498874257 ecr 1228193013], length 36
01:44:53.434431 IP comp3134-intro.ssh > cpe688f2e0f3fd3-cm688f2e0f3fd0.cpe.net.fido.ca.50292: Flags [P.], seq 324:584, ack 1, win 1567, options [nop,nop,TS val 2498874260 ecr 1228193013], length 260
01:44:53.434502 IP comp3134-intro.ssh > cpe688f2e0f3fd3-cm688f2e0f3fd0.cpe.net.fido.ca.50292: Flags [P.], seq 584:620, ack 1, win 1567, options [nop,nop,TS val 2498874260 ecr 1228193013], length 36
01:44:53.434613 IP comp3134-intro.ssh > cpe688f2e0f3fd3-cm688f2e0f3fd0.cpe.net.fido.ca.50292: Flags [P.], seq 620:856, ack 1, win 1567, options [nop,nop,TS val 2498874260 ecr 1228193013], length 236
01:44:53.434663 IP comp3134-intro.ssh > cpe688f2e0f3fd3-cm688f2e0f3fd0.cpe.net.fido.ca.50292: Flags [P.], seq 856:892, ack 1, win 1567, options [nop,nop,TS val 2498874260 ecr 1228193013], length 36
01:44:53.434722 IP comp3134-intro.ssh > cpe688f2e0f3fd3-cm688f2e0f3fd0.cpe.net.fido.ca.50292: Flags [P.], seq 892:1128, ack 1, win 1567, options [nop,nop,TS val 2498874260 ecr 1228193013], length 236
01:44:53.443829 IP cpe688f2e0f3fd3-cm688f2e0f3fd0.cpe.net.fido.ca.50292 > comp3134-intro.ssh: Flags [.], ack 36, win 32767, options [nop,nop,TS val 1228193037 ecr 2498874256], length 0
01:44:53.443875 IP comp3134-intro.ssh > cpe688f2e0f3fd3-cm688f2e0f3fd0.cpe.net.fido.ca.50292: Flags [P.], seq 1128:3068, ack 1, win 1567, options [nop,nop,TS val 2498874269 ecr 1228193037], length 1940
01:44:53.450722 IP cpe688f2e0f3fd3-cm688f2e0f3fd0.cpe.net.fido.ca.50292 > comp3134-intro.ssh: Flags [.], ack 288, win 32766, options [nop,nop,TS val 1228193041 ecr 2498874257], length 0
01:44:53.450722 IP cpe688f2e0f3fd3-cm688f2e0f3fd0.cpe.net.fido.ca.50292 > comp3134-intro.ssh: Flags [.], ack 584, win 32763, options [nop,nop,TS val 1228193042 ecr 2498874260], length 0
01:44:53.450772 IP comp3134-intro.ssh > cpe688f2e0f3fd3-cm688f2e0f3fd0.cpe.net.fido.ca.50292: Flags [P.], seq 3068:3596, ack 1, win 1567, options [nop,nop,TS val 2498874276 ecr 1228193041], length 528
01:44:53.450926 IP comp3134-intro.ssh > cpe688f2e0f3fd3-cm688f2e0f3fd0.cpe.net.fido.ca.50292: Flags [P.], seq 3596:3816, ack 1, win 1567, options [nop,nop,TS val 2498874276 ecr 1228193042], length 220
01:44:53.450994 IP comp3134-intro.ssh > cpe688f2e0f3fd3-cm688f2e0f3fd0.cpe.net.fido.ca.50292: Flags [P.], seq 3816:3852, ack 1, win 1567, options [nop,nop,TS val 2498874276 ecr 1228193042], length 36
01:44:53.451068 IP comp3134-intro.ssh > cpe688f2e0f3fd3-cm688f2e0f3fd0.cpe.net.fido.ca.50292: Flags [P.], seq 3852:4072, ack 1, win 1567, options [nop,nop,TS val 2498874276 ecr 1228193042], length 220
01:44:53.451125 IP comp3134-intro.ssh > cpe688f2e0f3fd3-cm688f2e0f3fd0.cpe.net.fido.ca.50292: Flags [P.], seq 4072:4108, ack 1, win 1567, options [nop,nop,TS val 2498874277 ecr 1228193042], length 36
01:44:53.451196 IP comp3134-intro.ssh > cpe688f2e0f3fd3-cm688f2e0f3fd0.cpe.net.fido.ca.50292: Flags [P.], seq 4108:4344, ack 1, win 1567, options [nop,nop,TS val 2498874277 ecr 1228193042], length 236
01:44:53.451252 IP comp3134-intro.ssh > cpe688f2e0f3fd3-cm688f2e0f3fd0.cpe.net.fido.ca.50292: Flags [P.], seq 4344:4380, ack 1, win 1567, options [nop,nop,TS val 2498874277 ecr 1228193042], length 36
01:44:53.451332 IP comp3134-intro.ssh > cpe688f2e0f3fd3-cm688f2e0f3fd0.cpe.net.fido.ca.50292: Flags [P.], seq 4380:4616, ack 1, win 1567, options [nop,nop,TS val 2498874277 ecr 1228193042], length 236
01:44:53.451389 IP comp3134-intro.ssh > cpe688f2e0f3fd3-cm688f2e0f3fd0.cpe.net.fido.ca.50292: Flags [P.], seq 4616:4652, ack 1, win 1567, options [nop,nop,TS val 2498874277 ecr 1228193042], length 36
01:44:53.451459 IP comp3134-intro.ssh > cpe688f2e0f3fd3-cm688f2e0f3fd0.cpe.net.fido.ca.50292: Flags [P.], seq 4652:4888, ack 1, win 1567, options [nop,nop,TS val 2498874277 ecr 1228193042], length 236
01:44:53.497281 IP comp3134-intro.ssh > cpe688f2e0f3fd3-cm688f2e0f3fd0.cpe.net.fido.ca.50292: Flags [.], seq 4888:6336, ack 1, win 1567, options [nop,nop,TS val 2498874323 ecr 1228193042], length 1448
01:44:53.631110 IP cpe688f2e0f3fd3-cm688f2e0f3fd0.cpe.net.fido.ca.50292 > comp3134-intro.ssh: Flags [.], ack 620, win 32767, options [nop,nop,TS val 1228193224 ecr 2498874260], length 0
01:44:53.631177 IP comp3134-intro.ssh > cpe688f2e0f3fd3-cm688f2e0f3fd0.cpe.net.fido.ca.50292: Flags [P.], seq 6336:7100, ack 1, win 1567, options [nop,nop,TS val 2498874457 ecr 1228193224], length 764
01:44:53.639274 IP cpe688f2e0f3fd3-cm688f2e0f3fd0.cpe.net.fido.ca.50292 > comp3134-intro.ssh: Flags [.], ack 1128, win 32759, options [nop,nop,TS val 1228193224 ecr 2498874260], length 0
01:44:53.639274 IP cpe688f2e0f3fd3-cm688f2e0f3fd0.cpe.net.fido.ca.50292 > comp3134-intro.ssh: Flags [.], ack 3068, win 32737, options [nop,nop,TS val 1228193225 ecr 2498874269], length 0
01:44:53.639274 IP cpe688f2e0f3fd3-cm688f2e0f3fd0.cpe.net.fido.ca.50292 > comp3134-intro.ssh: Flags [.], ack 4888, win 32747, options [nop,nop,TS val 1228193225 ecr 2498874277], length 0
01:44:53.639331 IP comp3134-intro.ssh > cpe688f2e0f3fd3-cm688f2e0f3fd0.cpe.net.fido.ca.50292: Flags [P.], seq 7100:7628, ack 1, win 1567, options [nop,nop,TS val 2498874465 ecr 1228193224], length 528
01:44:53.639532 IP comp3134-intro.ssh > cpe688f2e0f3fd3-cm688f2e0f3fd0.cpe.net.fido.ca.50292: Flags [P.], seq 7628:7848, ack 1, win 1567, options [nop,nop,TS val 2498874465 ecr 1228193225], length 220
01:44:53.639599 IP comp3134-intro.ssh > cpe688f2e0f3fd3-cm688f2e0f3fd0.cpe.net.fido.ca.50292: Flags [P.], seq 7848:7884, ack 1, win 1567, options [nop,nop,TS val 2498874465 ecr 1228193225], length 36
01:44:53.639663 IP comp3134-intro.ssh > cpe688f2e0f3fd3-cm688f2e0f3fd0.cpe.net.fido.ca.50292: Flags [P.], seq 7884:8104, ack 1, win 1567, options [nop,nop,TS val 2498874465 ecr 1228193225], length 220
01:44:53.639707 IP comp3134-intro.ssh > cpe688f2e0f3fd3-cm688f2e0f3fd0.cpe.net.fido.ca.50292: Flags [P.], seq 8104:8140, ack 1, win 1567, options [nop,nop,TS val 2498874465 ecr 1228193225], length 36
01:44:53.639763 IP comp3134-intro.ssh > cpe688f2e0f3fd3-cm688f2e0f3fd0.cpe.net.fido.ca.50292: Flags [P.], seq 8140:8360, ack 1, win 1567, options [nop,nop,TS val 2498874465 ecr 1228193225], length 220
01:44:53.639804 IP comp3134-intro.ssh > cpe688f2e0f3fd3-cm688f2e0f3fd0.cpe.net.fido.ca.50292: Flags [P.], seq 8360:8396, ack 1, win 1567, options [nop,nop,TS val 2498874465 ecr 1228193225], length 36
01:44:53.639860 IP comp3134-intro.ssh > cpe688f2e0f3fd3-cm688f2e0f3fd0.cpe.net.fido.ca.50292: Flags [P.], seq 8396:8632, ack 1, win 1567, options [nop,nop,TS val 2498874465 ecr 1228193225], length 236
01:44:53.639911 IP comp3134-intro.ssh > cpe688f2e0f3fd3-cm688f2e0f3fd0.cpe.net.fido.ca.50292: Flags [P.], seq 8632:8668, ack 1, win 1567, options [nop,nop,TS val 2498874465 ecr 1228193225], length 36
01:44:53.639979 IP comp3134-intro.ssh > cpe688f2e0f3fd3-cm688f2e0f3fd0.cpe.net.fido.ca.50292: Flags [P.], seq 8668:8904, ack 1, win 1567, options [nop,nop,TS val 2498874465 ecr 1228193225], length 236
01:44:53.640046 IP comp3134-intro.ssh > cpe688f2e0f3fd3-cm688f2e0f3fd0.cpe.net.fido.ca.50292: Flags [P.], seq 8904:8940, ack 1, win 1567, options [nop,nop,TS val 2498874465 ecr 1228193225], length 36
01:44:53.640061 IP comp3134-intro.ssh > cpe688f2e0f3fd3-cm688f2e0f3fd0.cpe.net.fido.ca.50292: Flags [P.], seq 8940:9176, ack 1, win 1567, options [nop,nop,TS val 2498874465 ecr 1228193225], length 236
01:44:53.640099 IP comp3134-intro.ssh > cpe688f2e0f3fd3-cm688f2e0f3fd0.cpe.net.fido.ca.50292: Flags [P.], seq 9176:9212, ack 1, win 1567, options [nop,nop,TS val 2498874465 ecr 1228193225], length 36
01:44:53.640153 IP comp3134-intro.ssh > cpe688f2e0f3fd3-cm688f2e0f3fd0.cpe.net.fido.ca.50292: Flags [P.], seq 9212:9448, ack 1, win 1567, options [nop,nop,TS val 2498874466 ecr 1228193225], length 236
01:44:53.640193 IP comp3134-intro.ssh > cpe688f2e0f3fd3-cm688f2e0f3fd0.cpe.net.fido.ca.50292: Flags [P.], seq 9448:9484, ack 1, win 1567, options [nop,nop,TS val 2498874466 ecr 1228193225], length 36
01:44:53.640246 IP comp3134-intro.ssh > cpe688f2e0f3fd3-cm688f2e0f3fd0.cpe.net.fido.ca.50292: Flags [P.], seq 9484:9720, ack 1, win 1567, options [nop,nop,TS val 2498874466 ecr 1228193225], length 236
01:44:53.640288 IP comp3134-intro.ssh > cpe688f2e0f3fd3-cm688f2e0f3fd0.cpe.net.fido.ca.50292: Flags [P.], seq 9720:9756, ack 1, win 1567, options [nop,nop,TS val 2498874466 ecr 1228193225], length 36
01:44:53.640340 IP comp3134-intro.ssh > cpe688f2e0f3fd3-cm688f2e0f3fd0.cpe.net.fido.ca.50292: Flags [P.], seq 9756:9992, ack 1, win 1567, options [nop,nop,TS val 2498874466 ecr 1228193225], length 236
01:44:53.640379 IP comp3134-intro.ssh > cpe688f2e0f3fd3-cm688f2e0f3fd0.cpe.net.fido.ca.50292: Flags [P.], seq 9992:10028, ack 1, win 1567, options [nop,nop,TS val 2498874466 ecr 1228193225], length 36
01:44:53.640444 IP comp3134-intro.ssh > cpe688f2e0f3fd3-cm688f2e0f3fd0.cpe.net.fido.ca.50292: Flags [P.], seq 10028:10264, ack 1, win 1567, options [nop,nop,TS val 2498874466 ecr 1228193225], length 236
01:44:53.640514 IP comp3134-intro.ssh > cpe688f2e0f3fd3-cm688f2e0f3fd0.cpe.net.fido.ca.50292: Flags [P.], seq 10264:10300, ack 1, win 1567, options [nop,nop,TS val 2498874466 ecr 1228193225], length 36
01:44:53.640587 IP comp3134-intro.ssh > cpe688f2e0f3fd3-cm688f2e0f3fd0.cpe.net.fido.ca.50292: Flags [P.], seq 10300:10536, ack 1, win 1567, options [nop,nop,TS val 2498874466 ecr 1228193225], length 236
01:44:53.640630 IP comp3134-intro.ssh > cpe688f2e0f3fd3-cm688f2e0f3fd0.cpe.net.fido.ca.50292: Flags [P.], seq 10536:10572, ack 1, win 1567, options [nop,nop,TS val 2498874466 ecr 1228193225], length 36
01:44:53.640684 IP comp3134-intro.ssh > cpe688f2e0f3fd3-cm688f2e0f3fd0.cpe.net.fido.ca.50292: Flags [P.], seq 10572:10808, ack 1, win 1567, options [nop,nop,TS val 2498874466 ecr 1228193225], length 236
01:44:53.640733 IP comp3134-intro.ssh > cpe688f2e0f3fd3-cm688f2e0f3fd0.cpe.net.fido.ca.50292: Flags [P.], seq 10808:10844, ack 1, win 1567, options [nop,nop,TS val 2498874466 ecr 1228193225], length 36
01:44:53.640788 IP comp3134-intro.ssh > cpe688f2e0f3fd3-cm688f2e0f3fd0.cpe.net.fido.ca.50292: Flags [P.], seq 10844:11080, ack 1, win 1567, options [nop,nop,TS val 2498874466 ecr 1228193225], length 236
01:44:53.640829 IP comp3134-intro.ssh > cpe688f2e0f3fd3-cm688f2e0f3fd0.cpe.net.fido.ca.50292: Flags [P.], seq 11080:11116, ack 1, win 1567, options [nop,nop,TS val 2498874466 ecr 1228193225], length 36
01:44:53.640888 IP comp3134-intro.ssh > cpe688f2e0f3fd3-cm688f2e0f3fd0.cpe.net.fido.ca.50292: Flags [P.], seq 11116:11352, ack 1, win 1567, options [nop,nop,TS val 2498874466 ecr 1228193225], length 236
01:44:53.640934 IP comp3134-intro.ssh > cpe688f2e0f3fd3-cm688f2e0f3fd0.cpe.net.fido.ca.50292: Flags [P.], seq 11352:11388, ack 1, win 1567, options [nop,nop,TS val 2498874466 ecr 1228193225], length 36
01:44:53.640987 IP comp3134-intro.ssh > cpe688f2e0f3fd3-cm688f2e0f3fd0.cpe.net.fido.ca.50292: Flags [P.], seq 11388:11624, ack 1, win 1567, options [nop,nop,TS val 2498874466 ecr 1228193225], length 236
01:44:53.645099 IP cpe688f2e0f3fd3-cm688f2e0f3fd0.cpe.net.fido.ca.50292 > comp3134-intro.ssh: Flags [.], ack 7100, win 32756, options [nop,nop,TS val 1228193236 ecr 2498874323], length 0
01:44:53.645100 IP cpe688f2e0f3fd3-cm688f2e0f3fd0.cpe.net.fido.ca.50292 > comp3134-intro.ssh: Flags [.], ack 7628, win 32759, options [nop,nop,TS val 1228193242 ecr 2498874465], length 0
01:44:53.645136 IP comp3134-intro.ssh > cpe688f2e0f3fd3-cm688f2e0f3fd0.cpe.net.fido.ca.50292: Flags [P.], seq 11624:14520, ack 1, win 1567, options [nop,nop,TS val 2498874471 ecr 1228193236], length 2896
01:44:53.645151 IP comp3134-intro.ssh > cpe688f2e0f3fd3-cm688f2e0f3fd0.cpe.net.fido.ca.50292: Flags [P.], seq 14520:16556, ack 1, win 1567, options [nop,nop,TS val 2498874471 ecr 1228193236], length 2036
01:44:53.645260 IP comp3134-intro.ssh > cpe688f2e0f3fd3-cm688f2e0f3fd0.cpe.net.fido.ca.50292: Flags [P.], seq 16556:16776, ack 1, win 1567, options [nop,nop,TS val 2498874471 ecr 1228193242], length 220
01:44:53.645309 IP comp3134-intro.ssh > cpe688f2e0f3fd3-cm688f2e0f3fd0.cpe.net.fido.ca.50292: Flags [P.], seq 16776:16812, ack 1, win 1567, options [nop,nop,TS val 2498874471 ecr 1228193242], length 36
01:44:53.653933 IP cpe688f2e0f3fd3-cm688f2e0f3fd0.cpe.net.fido.ca.50292 > comp3134-intro.ssh: Flags [.], ack 7848, win 32764, options [nop,nop,TS val 1228193245 ecr 2498874465], length 0
01:44:53.653981 IP comp3134-intro.ssh > cpe688f2e0f3fd3-cm688f2e0f3fd0.cpe.net.fido.ca.50292: Flags [P.], seq 16812:18172, ack 1, win 1567, options [nop,nop,TS val 2498874479 ecr 1228193245], length 1360
01:44:53.654149 IP comp3134-intro.ssh > cpe688f2e0f3fd3-cm688f2e0f3fd0.cpe.net.fido.ca.50292: Flags [P.], seq 18172:18392, ack 1, win 1567, options [nop,nop,TS val 2498874480 ecr 1228193245], length 220
01:44:53.663436 IP cpe688f2e0f3fd3-cm688f2e0f3fd0.cpe.net.fido.ca.50292 > comp3134-intro.ssh: Flags [.], ack 9176, win 32755, options [nop,nop,TS val 1228193245 ecr 2498874465], length 0
01:44:53.663437 IP cpe688f2e0f3fd3-cm688f2e0f3fd0.cpe.net.fido.ca.50292 > comp3134-intro.ssh: Flags [.], ack 10536, win 32755, options [nop,nop,TS val 1228193245 ecr 2498874466], length 0
01:44:53.663437 IP cpe688f2e0f3fd3-cm688f2e0f3fd0.cpe.net.fido.ca.50292 > comp3134-intro.ssh: Flags [.], ack 11624, win 32764, options [nop,nop,TS val 1228193245 ecr 2498874466], length 0
01:44:53.663437 IP cpe688f2e0f3fd3-cm688f2e0f3fd0.cpe.net.fido.ca.50292 > comp3134-intro.ssh: Flags [.], ack 14520, win 32722, options [nop,nop,TS val 1228193249 ecr 2498874471], length 0
01:44:53.663437 IP cpe688f2e0f3fd3-cm688f2e0f3fd0.cpe.net.fido.ca.50292 > comp3134-intro.ssh: Flags [.], ack 14520, win 32768, options [nop,nop,TS val 1228193249 ecr 2498874471], length 0
01:44:53.663437 IP cpe688f2e0f3fd3-cm688f2e0f3fd0.cpe.net.fido.ca.50292 > comp3134-intro.ssh: Flags [.], ack 16556, win 32736, options [nop,nop,TS val 1228193250 ecr 2498874471], length 0
01:44:53.663437 IP cpe688f2e0f3fd3-cm688f2e0f3fd0.cpe.net.fido.ca.50292 > comp3134-intro.ssh: Flags [.], ack 16812, win 32754, options [nop,nop,TS val 1228193250 ecr 2498874471], length 0
01:44:53.663521 IP comp3134-intro.ssh > cpe688f2e0f3fd3-cm688f2e0f3fd0.cpe.net.fido.ca.50292: Flags [P.], seq 18392:18980, ack 1, win 1567, options [nop,nop,TS val 2498874489 ecr 1228193245], length 588
01:44:53.663737 IP comp3134-intro.ssh > cpe688f2e0f3fd3-cm688f2e0f3fd0.cpe.net.fido.ca.50292: Flags [P.], seq 18980:19200, ack 1, win 1567, options [nop,nop,TS val 2498874489 ecr 1228193250], length 220
01:44:53.663795 IP comp3134-intro.ssh > cpe688f2e0f3fd3-cm688f2e0f3fd0.cpe.net.fido.ca.50292: Flags [P.], seq 19200:19236, ack 1, win 1567, options [nop,nop,TS val 2498874489 ecr 1228193250], length 36
01:44:53.663856 IP comp3134-intro.ssh > cpe688f2e0f3fd3-cm688f2e0f3fd0.cpe.net.fido.ca.50292: Flags [P.], seq 19236:19464, ack 1, win 1567, options [nop,nop,TS val 2498874489 ecr 1228193250], length 228
01:44:53.663902 IP comp3134-intro.ssh > cpe688f2e0f3fd3-cm688f2e0f3fd0.cpe.net.fido.ca.50292: Flags [P.], seq 19464:19500, ack 1, win 1567, options [nop,nop,TS val 2498874489 ecr 1228193250], length 36
01:44:53.663956 IP comp3134-intro.ssh > cpe688f2e0f3fd3-cm688f2e0f3fd0.cpe.net.fido.ca.50292: Flags [P.], seq 19500:19728, ack 1, win 1567, options [nop,nop,TS val 2498874489 ecr 1228193250], length 228
01:44:53.663996 IP comp3134-intro.ssh > cpe688f2e0f3fd3-cm688f2e0f3fd0.cpe.net.fido.ca.50292: Flags [P.], seq 19728:19764, ack 1, win 1567, options [nop,nop,TS val 2498874489 ecr 1228193250], length 36
01:44:53.664049 IP comp3134-intro.ssh > cpe688f2e0f3fd3-cm688f2e0f3fd0.cpe.net.fido.ca.50292: Flags [P.], seq 19764:19992, ack 1, win 1567, options [nop,nop,TS val 2498874489 ecr 1228193250], length 228
01:44:53.664092 IP comp3134-intro.ssh > cpe688f2e0f3fd3-cm688f2e0f3fd0.cpe.net.fido.ca.50292: Flags [P.], seq 19992:20028, ack 1, win 1567, options [nop,nop,TS val 2498874489 ecr 1228193250], length 36
01:44:53.664145 IP comp3134-intro.ssh > cpe688f2e0f3fd3-cm688f2e0f3fd0.cpe.net.fido.ca.50292: Flags [P.], seq 20028:20256, ack 1, win 1567, options [nop,nop,TS val 2498874490 ecr 1228193250], length 228
01:44:53.664219 IP comp3134-intro.ssh > cpe688f2e0f3fd3-cm688f2e0f3fd0.cpe.net.fido.ca.50292: Flags [P.], seq 20256:20520, ack 1, win 1567, options [nop,nop,TS val 2498874490 ecr 1228193250], length 264
01:44:53.664259 IP comp3134-intro.ssh > cpe688f2e0f3fd3-cm688f2e0f3fd0.cpe.net.fido.ca.50292: Flags [P.], seq 20520:20556, ack 1, win 1567, options [nop,nop,TS val 2498874490 ecr 1228193250], length 36
01:44:53.664312 IP comp3134-intro.ssh > cpe688f2e0f3fd3-cm688f2e0f3fd0.cpe.net.fido.ca.50292: Flags [P.], seq 20556:20784, ack 1, win 1567, options [nop,nop,TS val 2498874490 ecr 1228193250], length 228
01:44:53.664351 IP comp3134-intro.ssh > cpe688f2e0f3fd3-cm688f2e0f3fd0.cpe.net.fido.ca.50292: Flags [P.], seq 20784:20820, ack 1, win 1567, options [nop,nop,TS val 2498874490 ecr 1228193250], length 36
01:44:53.664428 IP comp3134-intro.ssh > cpe688f2e0f3fd3-cm688f2e0f3fd0.cpe.net.fido.ca.50292: Flags [P.], seq 20820:21056, ack 1, win 1567, options [nop,nop,TS val 2498874490 ecr 1228193250], length 236
01:44:53.664492 IP comp3134-intro.ssh > cpe688f2e0f3fd3-cm688f2e0f3fd0.cpe.net.fido.ca.50292: Flags [P.], seq 21056:21328, ack 1, win 1567, options [nop,nop,TS val 2498874490 ecr 1228193250], length 272
01:44:53.664597 IP comp3134-intro.ssh > cpe688f2e0f3fd3-cm688f2e0f3fd0.cpe.net.fido.ca.50292: Flags [P.], seq 21328:21872, ack 1, win 1567, options [nop,nop,TS val 2498874490 ecr 1228193250], length 544
01:44:53.664625 IP comp3134-intro.ssh > cpe688f2e0f3fd3-cm688f2e0f3fd0.cpe.net.fido.ca.50292: Flags [P.], seq 21872:21908, ack 1, win 1567, options [nop,nop,TS val 2498874490 ecr 1228193250], length 36
01:44:53.664677 IP comp3134-intro.ssh > cpe688f2e0f3fd3-cm688f2e0f3fd0.cpe.net.fido.ca.50292: Flags [P.], seq 21908:22144, ack 1, win 1567, options [nop,nop,TS val 2498874490 ecr 1228193250], length 236
01:44:53.664718 IP comp3134-intro.ssh > cpe688f2e0f3fd3-cm688f2e0f3fd0.cpe.net.fido.ca.50292: Flags [P.], seq 22144:22180, ack 1, win 1567, options [nop,nop,TS val 2498874490 ecr 1228193250], length 36
01:44:53.664771 IP comp3134-intro.ssh > cpe688f2e0f3fd3-cm688f2e0f3fd0.cpe.net.fido.ca.50292: Flags [P.], seq 22180:22416, ack 1, win 1567, options [nop,nop,TS val 2498874490 ecr 1228193250], length 236
01:44:53.664811 IP comp3134-intro.ssh > cpe688f2e0f3fd3-cm688f2e0f3fd0.cpe.net.fido.ca.50292: Flags [P.], seq 22416:22452, ack 1, win 1567, options [nop,nop,TS val 2498874490 ecr 1228193250], length 36
01:44:53.664863 IP comp3134-intro.ssh > cpe688f2e0f3fd3-cm688f2e0f3fd0.cpe.net.fido.ca.50292: Flags [P.], seq 22452:22688, ack 1, win 1567, options [nop,nop,TS val 2498874490 ecr 1228193250], length 236
01:44:53.664906 IP comp3134-intro.ssh > cpe688f2e0f3fd3-cm688f2e0f3fd0.cpe.net.fido.ca.50292: Flags [P.], seq 22688:22724, ack 1, win 1567, options [nop,nop,TS val 2498874490 ecr 1228193250], length 36
01:44:53.664989 IP comp3134-intro.ssh > cpe688f2e0f3fd3-cm688f2e0f3fd0.cpe.net.fido.ca.50292: Flags [P.], seq 22724:22960, ack 1, win 1567, options [nop,nop,TS val 2498874490 ecr 1228193250], length 236
01:44:53.665071 IP comp3134-intro.ssh > cpe688f2e0f3fd3-cm688f2e0f3fd0.cpe.net.fido.ca.50292: Flags [P.], seq 22960:22996, ack 1, win 1567, options [nop,nop,TS val 2498874490 ecr 1228193250], length 36
01:44:53.665219 IP comp3134-intro.ssh > cpe688f2e0f3fd3-cm688f2e0f3fd0.cpe.net.fido.ca.50292: Flags [P.], seq 22996:23232, ack 1, win 1567, options [nop,nop,TS val 2498874491 ecr 1228193250], length 236
01:44:53.665284 IP comp3134-intro.ssh > cpe688f2e0f3fd3-cm688f2e0f3fd0.cpe.net.fido.ca.50292: Flags [P.], seq 23232:23268, ack 1, win 1567, options [nop,nop,TS val 2498874491 ecr 1228193250], length 36
01:44:53.665346 IP comp3134-intro.ssh > cpe688f2e0f3fd3-cm688f2e0f3fd0.cpe.net.fido.ca.50292: Flags [P.], seq 23268:23504, ack 1, win 1567, options [nop,nop,TS val 2498874491 ecr 1228193250], length 236
01:44:53.665388 IP comp3134-intro.ssh > cpe688f2e0f3fd3-cm688f2e0f3fd0.cpe.net.fido.ca.50292: Flags [P.], seq 23504:23540, ack 1, win 1567, options [nop,nop,TS val 2498874491 ecr 1228193250], length 36
01:44:53.665442 IP comp3134-intro.ssh > cpe688f2e0f3fd3-cm688f2e0f3fd0.cpe.net.fido.ca.50292: Flags [P.], seq 23540:23776, ack 1, win 1567, options [nop,nop,TS val 2498874491 ecr 1228193250], length 236
01:44:53.665511 IP comp3134-intro.ssh > cpe688f2e0f3fd3-cm688f2e0f3fd0.cpe.net.fido.ca.50292: Flags [P.], seq 23776:23812, ack 1, win 1567, options [nop,nop,TS val 2498874491 ecr 1228193250], length 36
01:44:53.665536 IP comp3134-intro.ssh > cpe688f2e0f3fd3-cm688f2e0f3fd0.cpe.net.fido.ca.50292: Flags [P.], seq 23812:24048, ack 1, win 1567, options [nop,nop,TS val 2498874491 ecr 1228193250], length 236
01:44:53.665573 IP comp3134-intro.ssh > cpe688f2e0f3fd3-cm688f2e0f3fd0.cpe.net.fido.ca.50292: Flags [P.], seq 24048:24084, ack 1, win 1567, options [nop,nop,TS val 2498874491 ecr 1228193250], length 36
01:44:53.665628 IP comp3134-intro.ssh > cpe688f2e0f3fd3-cm688f2e0f3fd0.cpe.net.fido.ca.50292: Flags [P.], seq 24084:24320, ack 1, win 1567, options [nop,nop,TS val 2498874491 ecr 1228193250], length 236
01:44:53.665692 IP comp3134-intro.ssh > cpe688f2e0f3fd3-cm688f2e0f3fd0.cpe.net.fido.ca.50292: Flags [P.], seq 24320:24356, ack 1, win 1567, options [nop,nop,TS val 2498874491 ecr 1228193250], length 36
01:44:53.665750 IP comp3134-intro.ssh > cpe688f2e0f3fd3-cm688f2e0f3fd0.cpe.net.fido.ca.50292: Flags [P.], seq 24356:24592, ack 1, win 1567, options [nop,nop,TS val 2498874491 ecr 1228193250], length 236
01:44:53.665793 IP comp3134-intro.ssh > cpe688f2e0f3fd3-cm688f2e0f3fd0.cpe.net.fido.ca.50292: Flags [P.], seq 24592:24628, ack 1, win 1567, options [nop,nop,TS val 2498874491 ecr 1228193250], length 36
01:44:53.665846 IP comp3134-intro.ssh > cpe688f2e0f3fd3-cm688f2e0f3fd0.cpe.net.fido.ca.50292: Flags [P.], seq 24628:24864, ack 1, win 1567, options [nop,nop,TS val 2498874491 ecr 1228193250], length 236
01:44:53.665888 IP comp3134-intro.ssh > cpe688f2e0f3fd3-cm688f2e0f3fd0.cpe.net.fido.ca.50292: Flags [P.], seq 24864:24900, ack 1, win 1567, options [nop,nop,TS val 2498874491 ecr 1228193250], length 36
01:44:53.665940 IP comp3134-intro.ssh > cpe688f2e0f3fd3-cm688f2e0f3fd0.cpe.net.fido.ca.50292: Flags [P.], seq 24900:25136, ack 1, win 1567, options [nop,nop,TS val 2498874491 ecr 1228193250], length 236
01:44:53.665992 IP comp3134-intro.ssh > cpe688f2e0f3fd3-cm688f2e0f3fd0.cpe.net.fido.ca.50292: Flags [P.], seq 25136:25172, ack 1, win 1567, options [nop,nop,TS val 2498874491 ecr 1228193250], length 36
01:44:53.666045 IP comp3134-intro.ssh > cpe688f2e0f3fd3-cm688f2e0f3fd0.cpe.net.fido.ca.50292: Flags [P.], seq 25172:25408, ack 1, win 1567, options [nop,nop,TS val 2498874491 ecr 1228193250], length 236
01:44:53.666115 IP comp3134-intro.ssh > cpe688f2e0f3fd3-cm688f2e0f3fd0.cpe.net.fido.ca.50292: Flags [P.], seq 25408:25444, ack 1, win 1567, options [nop,nop,TS val 2498874491 ecr 1228193250], length 36
01:44:53.666170 IP comp3134-intro.ssh > cpe688f2e0f3fd3-cm688f2e0f3fd0.cpe.net.fido.ca.50292: Flags [P.], seq 25444:25680, ack 1, win 1567, options [nop,nop,TS val 2498874492 ecr 1228193250], length 236
01:44:53.666210 IP comp3134-intro.ssh > cpe688f2e0f3fd3-cm688f2e0f3fd0.cpe.net.fido.ca.50292: Flags [P.], seq 25680:25716, ack 1, win 1567, options [nop,nop,TS val 2498874492 ecr 1228193250], length 36
01:44:53.666262 IP comp3134-intro.ssh > cpe688f2e0f3fd3-cm688f2e0f3fd0.cpe.net.fido.ca.50292: Flags [P.], seq 25716:25952, ack 1, win 1567, options [nop,nop,TS val 2498874492 ecr 1228193250], length 236
01:44:53.666317 IP comp3134-intro.ssh > cpe688f2e0f3fd3-cm688f2e0f3fd0.cpe.net.fido.ca.50292: Flags [P.], seq 25952:25988, ack 1, win 1567, options [nop,nop,TS val 2498874492 ecr 1228193250], length 36
01:44:53.666395 IP comp3134-intro.ssh > cpe688f2e0f3fd3-cm688f2e0f3fd0.cpe.net.fido.ca.50292: Flags [P.], seq 25988:26224, ack 1, win 1567, options [nop,nop,TS val 2498874492 ecr 1228193250], length 236
01:44:53.666466 IP comp3134-intro.ssh > cpe688f2e0f3fd3-cm688f2e0f3fd0.cpe.net.fido.ca.50292: Flags [P.], seq 26224:26260, ack 1, win 1567, options [nop,nop,TS val 2498874492 ecr 1228193250], length 36
01:44:53.666547 IP comp3134-intro.ssh > cpe688f2e0f3fd3-cm688f2e0f3fd0.cpe.net.fido.ca.50292: Flags [P.], seq 26260:26496, ack 1, win 1567, options [nop,nop,TS val 2498874492 ecr 1228193250], length 236
01:44:53.666592 IP comp3134-intro.ssh > cpe688f2e0f3fd3-cm688f2e0f3fd0.cpe.net.fido.ca.50292: Flags [P.], seq 26496:26532, ack 1, win 1567, options [nop,nop,TS val 2498874492 ecr 1228193250], length 36
01:44:53.666647 IP comp3134-intro.ssh > cpe688f2e0f3fd3-cm688f2e0f3fd0.cpe.net.fido.ca.50292: Flags [P.], seq 26532:26768, ack 1, win 1567, options [nop,nop,TS val 2498874492 ecr 1228193250], length 236
01:44:53.666739 IP comp3134-intro.ssh > cpe688f2e0f3fd3-cm688f2e0f3fd0.cpe.net.fido.ca.50292: Flags [P.], seq 26804:27040, ack 1, win 1567, options [nop,nop,TS val 2498874492 ecr 1228193250], length 236
01:44:53.666831 IP comp3134-intro.ssh > cpe688f2e0f3fd3-cm688f2e0f3fd0.cpe.net.fido.ca.50292: Flags [P.], seq 27076:27312, ack 1, win 1567, options [nop,nop,TS val 2498874492 ecr 1228193250], length 236
01:44:53.666979 IP comp3134-intro.ssh > cpe688f2e0f3fd3-cm688f2e0f3fd0.cpe.net.fido.ca.50292: Flags [P.], seq 27348:27584, ack 1, win 1567, options [nop,nop,TS val 2498874492 ecr 1228193250], length 236
01:44:53.667125 IP comp3134-intro.ssh > cpe688f2e0f3fd3-cm688f2e0f3fd0.cpe.net.fido.ca.50292: Flags [P.], seq 27620:27856, ack 1, win 1567, options [nop,nop,TS val 2498874493 ecr 1228193250], length 236
01:44:53.667230 IP comp3134-intro.ssh > cpe688f2e0f3fd3-cm688f2e0f3fd0.cpe.net.fido.ca.50292: Flags [P.], seq 27892:28128, ack 1, win 1567, options [nop,nop,TS val 2498874493 ecr 1228193250], length 236
01:44:53.667341 IP comp3134-intro.ssh > cpe688f2e0f3fd3-cm688f2e0f3fd0.cpe.net.fido.ca.50292: Flags [P.], seq 28164:28400, ack 1, win 1567, options [nop,nop,TS val 2498874493 ecr 1228193250], length 236
01:44:53.667511 IP comp3134-intro.ssh > cpe688f2e0f3fd3-cm688f2e0f3fd0.cpe.net.fido.ca.50292: Flags [P.], seq 28436:28672, ack 1, win 1567, options [nop,nop,TS val 2498874493 ecr 1228193250], length 236
01:44:53.667594 IP comp3134-intro.ssh > cpe688f2e0f3fd3-cm688f2e0f3fd0.cpe.net.fido.ca.50292: Flags [P.], seq 28672:28708, ack 1, win 1567, options [nop,nop,TS val 2498874493 ecr 1228193250], length 36
01:44:53.669798 IP cpe688f2e0f3fd3-cm688f2e0f3fd0.cpe.net.fido.ca.50292 > comp3134-intro.ssh: Flags [.], ack 18172, win 32746, options [nop,nop,TS val 1228193257 ecr 2498874479], length 0
01:44:53.669798 IP cpe688f2e0f3fd3-cm688f2e0f3fd0.cpe.net.fido.ca.50292 > comp3134-intro.ssh: Flags [.], ack 18392, win 32743, options [nop,nop,TS val 1228193257 ecr 2498874480], length 0
01:44:53.669828 IP comp3134-intro.ssh > cpe688f2e0f3fd3-cm688f2e0f3fd0.cpe.net.fido.ca.50292: Flags [P.], seq 28708:31604, ack 1, win 1567, options [nop,nop,TS val 2498874495 ecr 1228193257], length 2896
01:44:53.669880 IP comp3134-intro.ssh > cpe688f2e0f3fd3-cm688f2e0f3fd0.cpe.net.fido.ca.50292: Flags [P.], seq 31604:34500, ack 1, win 1567, options [nop,nop,TS val 2498874495 ecr 1228193257], length 2896
01:44:53.676971 IP cpe688f2e0f3fd3-cm688f2e0f3fd0.cpe.net.fido.ca.50292 > comp3134-intro.ssh: Flags [.], ack 18980, win 32758, options [nop,nop,TS val 1228193266 ecr 2498874489], length 0
01:44:53.677012 IP comp3134-intro.ssh > cpe688f2e0f3fd3-cm688f2e0f3fd0.cpe.net.fido.ca.50292: Flags [P.], seq 34500:37184, ack 1, win 1567, options [nop,nop,TS val 2498874502 ecr 1228193266], length 2684
01:44:53.683947 IP cpe688f2e0f3fd3-cm688f2e0f3fd0.cpe.net.fido.ca.50292 > comp3134-intro.ssh: Flags [.], ack 19500, win 32750, options [nop,nop,TS val 1228193266 ecr 2498874489], length 0
01:44:53.683948 IP cpe688f2e0f3fd3-cm688f2e0f3fd0.cpe.net.fido.ca.50292 > comp3134-intro.ssh: Flags [.], ack 19728, win 32764, options [nop,nop,TS val 1228193268 ecr 2498874489], length 0
01:44:53.683948 IP cpe688f2e0f3fd3-cm688f2e0f3fd0.cpe.net.fido.ca.50292 > comp3134-intro.ssh: Flags [.], ack 21328, win 32759, options [nop,nop,TS val 1228193268 ecr 2498874490], length 0
01:44:53.683948 IP cpe688f2e0f3fd3-cm688f2e0f3fd0.cpe.net.fido.ca.50292 > comp3134-intro.ssh: Flags [.], ack 22996, win 32755, options [nop,nop,TS val 1228193268 ecr 2498874490], length 0
01:44:53.683948 IP cpe688f2e0f3fd3-cm688f2e0f3fd0.cpe.net.fido.ca.50292 > comp3134-intro.ssh: Flags [.], ack 24356, win 32763, options [nop,nop,TS val 1228193268 ecr 2498874491], length 0
01:44:53.683948 IP cpe688f2e0f3fd3-cm688f2e0f3fd0.cpe.net.fido.ca.50292 > comp3134-intro.ssh: Flags [.], ack 25716, win 32759, options [nop,nop,TS val 1228193268 ecr 2498874492], length 0
01:44:53.683948 IP cpe688f2e0f3fd3-cm688f2e0f3fd0.cpe.net.fido.ca.50292 > comp3134-intro.ssh: Flags [.], ack 27076, win 32763, options [nop,nop,TS val 1228193268 ecr 2498874492], length 0
01:44:53.683948 IP cpe688f2e0f3fd3-cm688f2e0f3fd0.cpe.net.fido.ca.50292 > comp3134-intro.ssh: Flags [.], ack 28436, win 32758, options [nop,nop,TS val 1228193268 ecr 2498874493], length 0
01:44:53.684020 IP comp3134-intro.ssh > cpe688f2e0f3fd3-cm688f2e0f3fd0.cpe.net.fido.ca.50292: Flags [P.], seq 37184:37728, ack 1, win 1567, options [nop,nop,TS val 2498874509 ecr 1228193266], length 544
01:44:53.684139 IP cpe688f2e0f3fd3-cm688f2e0f3fd0.cpe.net.fido.ca.50292 > comp3134-intro.ssh: Flags [.], ack 28708, win 32754, options [nop,nop,TS val 1228193268 ecr 2498874493], length 0
01:44:53.684290 IP comp3134-intro.ssh > cpe688f2e0f3fd3-cm688f2e0f3fd0.cpe.net.fido.ca.50292: Flags [P.], seq 37728:37956, ack 1, win 1567, options [nop,nop,TS val 2498874510 ecr 1228193268], length 228
01:44:53.684367 IP comp3134-intro.ssh > cpe688f2e0f3fd3-cm688f2e0f3fd0.cpe.net.fido.ca.50292: Flags [P.], seq 37956:38184, ack 1, win 1567, options [nop,nop,TS val 2498874510 ecr 1228193268], length 228
01:44:53.684466 IP comp3134-intro.ssh > cpe688f2e0f3fd3-cm688f2e0f3fd0.cpe.net.fido.ca.50292: Flags [P.], seq 38184:38596, ack 1, win 1567, options [nop,nop,TS val 2498874510 ecr 1228193268], length 412
01:44:53.684597 IP comp3134-intro.ssh > cpe688f2e0f3fd3-cm688f2e0f3fd0.cpe.net.fido.ca.50292: Flags [P.], seq 38596:39392, ack 1, win 1567, options [nop,nop,TS val 2498874510 ecr 1228193268], length 796
01:44:53.684753 IP comp3134-intro.ssh > cpe688f2e0f3fd3-cm688f2e0f3fd0.cpe.net.fido.ca.50292: Flags [P.], seq 39392:40436, ack 1, win 1567, options [nop,nop,TS val 2498874510 ecr 1228193268], length 1044
01:44:53.684835 IP comp3134-intro.ssh > cpe688f2e0f3fd3-cm688f2e0f3fd0.cpe.net.fido.ca.50292: Flags [P.], seq 40436:40880, ack 1, win 1567, options [nop,nop,TS val 2498874510 ecr 1228193268], length 444
01:44:53.684903 IP comp3134-intro.ssh > cpe688f2e0f3fd3-cm688f2e0f3fd0.cpe.net.fido.ca.50292: Flags [P.], seq 40880:41124, ack 1, win 1567, options [nop,nop,TS val 2498874510 ecr 1228193268], length 244
01:44:53.684966 IP comp3134-intro.ssh > cpe688f2e0f3fd3-cm688f2e0f3fd0.cpe.net.fido.ca.50292: Flags [P.], seq 41124:41368, ack 1, win 1567, options [nop,nop,TS val 2498874510 ecr 1228193268], length 244
01:44:53.685029 IP comp3134-intro.ssh > cpe688f2e0f3fd3-cm688f2e0f3fd0.cpe.net.fido.ca.50292: Flags [P.], seq 41368:41612, ack 1, win 1567, options [nop,nop,TS val 2498874510 ecr 1228193268], length 244
01:44:53.685092 IP comp3134-intro.ssh > cpe688f2e0f3fd3-cm688f2e0f3fd0.cpe.net.fido.ca.50292: Flags [P.], seq 41612:41856, ack 1, win 1567, options [nop,nop,TS val 2498874510 ecr 1228193268], length 244
01:44:53.685157 IP comp3134-intro.ssh > cpe688f2e0f3fd3-cm688f2e0f3fd0.cpe.net.fido.ca.50292: Flags [P.], seq 41856:42100, ack 1, win 1567, options [nop,nop,TS val 2498874511 ecr 1228193268], length 244
01:44:53.685241 IP comp3134-intro.ssh > cpe688f2e0f3fd3-cm688f2e0f3fd0.cpe.net.fido.ca.50292: Flags [P.], seq 42100:42344, ack 1, win 1567, options [nop,nop,TS val 2498874511 ecr 1228193268], length 244
01:44:53.685305 IP comp3134-intro.ssh > cpe688f2e0f3fd3-cm688f2e0f3fd0.cpe.net.fido.ca.50292: Flags [P.], seq 42344:42588, ack 1, win 1567, options [nop,nop,TS val 2498874511 ecr 1228193268], length 244
01:44:53.685367 IP comp3134-intro.ssh > cpe688f2e0f3fd3-cm688f2e0f3fd0.cpe.net.fido.ca.50292: Flags [P.], seq 42588:42832, ack 1, win 1567, options [nop,nop,TS val 2498874511 ecr 1228193268], length 244
01:44:53.685440 IP comp3134-intro.ssh > cpe688f2e0f3fd3-cm688f2e0f3fd0.cpe.net.fido.ca.50292: Flags [P.], seq 42832:43076, ack 1, win 1567, options [nop,nop,TS val 2498874511 ecr 1228193268], length 244
01:44:53.685503 IP comp3134-intro.ssh > cpe688f2e0f3fd3-cm688f2e0f3fd0.cpe.net.fido.ca.50292: Flags [P.], seq 43076:43320, ack 1, win 1567, options [nop,nop,TS val 2498874511 ecr 1228193268], length 244
01:44:53.685567 IP comp3134-intro.ssh > cpe688f2e0f3fd3-cm688f2e0f3fd0.cpe.net.fido.ca.50292: Flags [P.], seq 43320:43564, ack 1, win 1567, options [nop,nop,TS val 2498874511 ecr 1228193268], length 244
01:44:53.685627 IP comp3134-intro.ssh > cpe688f2e0f3fd3-cm688f2e0f3fd0.cpe.net.fido.ca.50292: Flags [P.], seq 43564:43808, ack 1, win 1567, options [nop,nop,TS val 2498874511 ecr 1228193268], length 244
01:44:53.685690 IP comp3134-intro.ssh > cpe688f2e0f3fd3-cm688f2e0f3fd0.cpe.net.fido.ca.50292: Flags [P.], seq 43808:44052, ack 1, win 1567, options [nop,nop,TS val 2498874511 ecr 1228193268], length 244
01:44:53.685754 IP comp3134-intro.ssh > cpe688f2e0f3fd3-cm688f2e0f3fd0.cpe.net.fido.ca.50292: Flags [P.], seq 44052:44296, ack 1, win 1567, options [nop,nop,TS val 2498874511 ecr 1228193268], length 244
01:44:53.685817 IP comp3134-intro.ssh > cpe688f2e0f3fd3-cm688f2e0f3fd0.cpe.net.fido.ca.50292: Flags [P.], seq 44296:44540, ack 1, win 1567, options [nop,nop,TS val 2498874511 ecr 1228193268], length 244
01:44:53.685881 IP comp3134-intro.ssh > cpe688f2e0f3fd3-cm688f2e0f3fd0.cpe.net.fido.ca.50292: Flags [P.], seq 44540:44784, ack 1, win 1567, options [nop,nop,TS val 2498874511 ecr 1228193268], length 244
01:44:53.685946 IP comp3134-intro.ssh > cpe688f2e0f3fd3-cm688f2e0f3fd0.cpe.net.fido.ca.50292: Flags [P.], seq 44784:45028, ack 1, win 1567, options [nop,nop,TS val 2498874511 ecr 1228193268], length 244
01:44:53.686007 IP comp3134-intro.ssh > cpe688f2e0f3fd3-cm688f2e0f3fd0.cpe.net.fido.ca.50292: Flags [P.], seq 45028:45272, ack 1, win 1567, options [nop,nop,TS val 2498874511 ecr 1228193268], length 244
01:44:53.686069 IP comp3134-intro.ssh > cpe688f2e0f3fd3-cm688f2e0f3fd0.cpe.net.fido.ca.50292: Flags [P.], seq 45272:45516, ack 1, win 1567, options [nop,nop,TS val 2498874511 ecr 1228193268], length 244
01:44:53.686130 IP comp3134-intro.ssh > cpe688f2e0f3fd3-cm688f2e0f3fd0.cpe.net.fido.ca.50292: Flags [P.], seq 45516:45760, ack 1, win 1567, options [nop,nop,TS val 2498874512 ecr 1228193268], length 244
01:44:53.686192 IP comp3134-intro.ssh > cpe688f2e0f3fd3-cm688f2e0f3fd0.cpe.net.fido.ca.50292: Flags [P.], seq 45760:46004, ack 1, win 1567, options [nop,nop,TS val 2498874512 ecr 1228193268], length 244
01:44:53.686253 IP comp3134-intro.ssh > cpe688f2e0f3fd3-cm688f2e0f3fd0.cpe.net.fido.ca.50292: Flags [P.], seq 46004:46248, ack 1, win 1567, options [nop,nop,TS val 2498874512 ecr 1228193268], length 244
01:44:53.686314 IP comp3134-intro.ssh > cpe688f2e0f3fd3-cm688f2e0f3fd0.cpe.net.fido.ca.50292: Flags [P.], seq 46248:46492, ack 1, win 1567, options [nop,nop,TS val 2498874512 ecr 1228193268], length 244
01:44:53.686391 IP comp3134-intro.ssh > cpe688f2e0f3fd3-cm688f2e0f3fd0.cpe.net.fido.ca.50292: Flags [P.], seq 46492:46736, ack 1, win 1567, options [nop,nop,TS val 2498874512 ecr 1228193268], length 244
01:44:53.686473 IP comp3134-intro.ssh > cpe688f2e0f3fd3-cm688f2e0f3fd0.cpe.net.fido.ca.50292: Flags [P.], seq 46736:46980, ack 1, win 1567, options [nop,nop,TS val 2498874512 ecr 1228193268], length 244
01:44:53.686537 IP comp3134-intro.ssh > cpe688f2e0f3fd3-cm688f2e0f3fd0.cpe.net.fido.ca.50292: Flags [P.], seq 46980:47224, ack 1, win 1567, options [nop,nop,TS val 2498874512 ecr 1228193268], length 244
01:44:53.686599 IP comp3134-intro.ssh > cpe688f2e0f3fd3-cm688f2e0f3fd0.cpe.net.fido.ca.50292: Flags [P.], seq 47224:47468, ack 1, win 1567, options [nop,nop,TS val 2498874512 ecr 1228193268], length 244
01:44:53.686664 IP comp3134-intro.ssh > cpe688f2e0f3fd3-cm688f2e0f3fd0.cpe.net.fido.ca.50292: Flags [P.], seq 47468:47712, ack 1, win 1567, options [nop,nop,TS val 2498874512 ecr 1228193268], length 244
01:44:53.686757 IP comp3134-intro.ssh > cpe688f2e0f3fd3-cm688f2e0f3fd0.cpe.net.fido.ca.50292: Flags [P.], seq 47712:47956, ack 1, win 1567, options [nop,nop,TS val 2498874512 ecr 1228193268], length 244
01:44:53.686820 IP comp3134-intro.ssh > cpe688f2e0f3fd3-cm688f2e0f3fd0.cpe.net.fido.ca.50292: Flags [P.], seq 47956:48200, ack 1, win 1567, options [nop,nop,TS val 2498874512 ecr 1228193268], length 244
01:44:53.686881 IP comp3134-intro.ssh > cpe688f2e0f3fd3-cm688f2e0f3fd0.cpe.net.fido.ca.50292: Flags [P.], seq 48200:48444, ack 1, win 1567, options [nop,nop,TS val 2498874512 ecr 1228193268], length 244
01:44:53.686947 IP comp3134-intro.ssh > cpe688f2e0f3fd3-cm688f2e0f3fd0.cpe.net.fido.ca.50292: Flags [P.], seq 48444:48688, ack 1, win 1567, options [nop,nop,TS val 2498874512 ecr 1228193268], length 244
01:44:53.687009 IP comp3134-intro.ssh > cpe688f2e0f3fd3-cm688f2e0f3fd0.cpe.net.fido.ca.50292: Flags [P.], seq 48688:48932, ack 1, win 1567, options [nop,nop,TS val 2498874512 ecr 1228193268], length 244
01:44:53.687072 IP comp3134-intro.ssh > cpe688f2e0f3fd3-cm688f2e0f3fd0.cpe.net.fido.ca.50292: Flags [P.], seq 48932:49176, ack 1, win 1567, options [nop,nop,TS val 2498874512 ecr 1228193268], length 244
01:44:53.687138 IP comp3134-intro.ssh > cpe688f2e0f3fd3-cm688f2e0f3fd0.cpe.net.fido.ca.50292: Flags [P.], seq 49176:49420, ack 1, win 1567, options [nop,nop,TS val 2498874513 ecr 1228193268], length 244
01:44:53.687202 IP comp3134-intro.ssh > cpe688f2e0f3fd3-cm688f2e0f3fd0.cpe.net.fido.ca.50292: Flags [P.], seq 49420:49664, ack 1, win 1567, options [nop,nop,TS val 2498874513 ecr 1228193268], length 244
01:44:53.687266 IP comp3134-intro.ssh > cpe688f2e0f3fd3-cm688f2e0f3fd0.cpe.net.fido.ca.50292: Flags [P.], seq 49664:49908, ack 1, win 1567, options [nop,nop,TS val 2498874513 ecr 1228193268], length 244
01:44:53.687328 IP comp3134-intro.ssh > cpe688f2e0f3fd3-cm688f2e0f3fd0.cpe.net.fido.ca.50292: Flags [P.], seq 49908:50152, ack 1, win 1567, options [nop,nop,TS val 2498874513 ecr 1228193268], length 244
01:44:53.687394 IP comp3134-intro.ssh > cpe688f2e0f3fd3-cm688f2e0f3fd0.cpe.net.fido.ca.50292: Flags [P.], seq 50152:50396, ack 1, win 1567, options [nop,nop,TS val 2498874513 ecr 1228193268], length 244
