root@comp3134-intro:~# tcpdump -n -i eth0
tcpdump: verbose output suppressed, use -v or -vv for full protocol decode
listening on eth0, link-type EN10MB (Ethernet), capture size 262144 bytes
01:43:12.290885 IP 147.182.157.116.22 > 72.141.88.185.50292: Flags [P.], seq 2403385455:2403385563, ack 1407545245, win 501, options [nop,nop,TS val 2498773116 ecr 1228093336], length 108
01:43:12.291047 IP 147.182.157.116.22 > 72.141.88.185.50292: Flags [P.], seq 108:144, ack 1, win 501, options [nop,nop,TS val 2498773116 ecr 1228093336], length 36
01:43:12.291087 IP 147.182.157.116.22 > 72.141.88.185.50292: Flags [P.], seq 144:252, ack 1, win 501, options [nop,nop,TS val 2498773116 ecr 1228093336], length 108
01:43:12.291133 IP 147.182.157.116.22 > 72.141.88.185.50292: Flags [P.], seq 252:288, ack 1, win 501, options [nop,nop,TS val 2498773117 ecr 1228093336], length 36
01:43:12.291288 IP 147.182.157.116.22 > 72.141.88.185.50292: Flags [P.], seq 288:516, ack 1, win 501, options [nop,nop,TS val 2498773117 ecr 1228093336], length 228
01:43:12.291342 IP 147.182.157.116.22 > 72.141.88.185.50292: Flags [P.], seq 516:552, ack 1, win 501, options [nop,nop,TS val 2498773117 ecr 1228093336], length 36
01:43:12.291408 IP 147.182.157.116.22 > 72.141.88.185.50292: Flags [P.], seq 552:756, ack 1, win 501, options [nop,nop,TS val 2498773117 ecr 1228093336], length 204
01:43:12.291460 IP 147.182.157.116.22 > 72.141.88.185.50292: Flags [P.], seq 756:792, ack 1, win 501, options [nop,nop,TS val 2498773117 ecr 1228093336], length 36
01:43:12.291522 IP 147.182.157.116.22 > 72.141.88.185.50292: Flags [P.], seq 792:996, ack 1, win 501, options [nop,nop,TS val 2498773117 ecr 1228093336], length 204
01:43:12.299218 IP 72.141.88.185.50292 > 147.182.157.116.22: Flags [.], ack 0, win 32767, options [nop,nop,TS val 1228093358 ecr 2498773111], length 0
01:43:12.299268 IP 147.182.157.116.22 > 72.141.88.185.50292: Flags [P.], seq 996:2472, ack 1, win 501, options [nop,nop,TS val 2498773125 ecr 1228093358], length 1476
01:43:12.305346 IP 72.141.88.185.50292 > 147.182.157.116.22: Flags [.], ack 108, win 32766, options [nop,nop,TS val 1228093362 ecr 2498773116], length 0
01:43:12.305346 IP 72.141.88.185.50292 > 147.182.157.116.22: Flags [.], ack 996, win 32760, options [nop,nop,TS val 1228093362 ecr 2498773117], length 0
01:43:12.305404 IP 147.182.157.116.22 > 72.141.88.185.50292: Flags [P.], seq 2472:2936, ack 1, win 501, options [nop,nop,TS val 2498773131 ecr 1228093362], length 464
01:43:12.305568 IP 147.182.157.116.22 > 72.141.88.185.50292: Flags [P.], seq 2936:3124, ack 1, win 501, options [nop,nop,TS val 2498773131 ecr 1228093362], length 188
01:43:12.305631 IP 147.182.157.116.22 > 72.141.88.185.50292: Flags [P.], seq 3124:3160, ack 1, win 501, options [nop,nop,TS val 2498773131 ecr 1228093362], length 36
01:43:12.305702 IP 147.182.157.116.22 > 72.141.88.185.50292: Flags [P.], seq 3160:3348, ack 1, win 501, options [nop,nop,TS val 2498773131 ecr 1228093362], length 188
01:43:12.305767 IP 147.182.157.116.22 > 72.141.88.185.50292: Flags [P.], seq 3348:3384, ack 1, win 501, options [nop,nop,TS val 2498773131 ecr 1228093362], length 36
01:43:12.305803 IP 147.182.157.116.22 > 72.141.88.185.50292: Flags [P.], seq 3384:3588, ack 1, win 501, options [nop,nop,TS val 2498773131 ecr 1228093362], length 204
01:43:12.305849 IP 147.182.157.116.22 > 72.141.88.185.50292: Flags [P.], seq 3588:3624, ack 1, win 501, options [nop,nop,TS val 2498773131 ecr 1228093362], length 36
01:43:12.305897 IP 147.182.157.116.22 > 72.141.88.185.50292: Flags [P.], seq 3624:3828, ack 1, win 501, options [nop,nop,TS val 2498773131 ecr 1228093362], length 204
01:43:12.305934 IP 147.182.157.116.22 > 72.141.88.185.50292: Flags [P.], seq 3828:3864, ack 1, win 501, options [nop,nop,TS val 2498773131 ecr 1228093362], length 36
01:43:12.305986 IP 147.182.157.116.22 > 72.141.88.185.50292: Flags [P.], seq 3864:4068, ack 1, win 501, options [nop,nop,TS val 2498773131 ecr 1228093362], length 204
01:43:12.306025 IP 147.182.157.116.22 > 72.141.88.185.50292: Flags [P.], seq 4068:4104, ack 1, win 501, options [nop,nop,TS val 2498773131 ecr 1228093362], length 36
01:43:12.306086 IP 147.182.157.116.22 > 72.141.88.185.50292: Flags [P.], seq 4104:4308, ack 1, win 501, options [nop,nop,TS val 2498773131 ecr 1228093362], length 204
01:43:12.306127 IP 147.182.157.116.22 > 72.141.88.185.50292: Flags [P.], seq 4308:4344, ack 1, win 501, options [nop,nop,TS val 2498773132 ecr 1228093362], length 36
01:43:12.306180 IP 147.182.157.116.22 > 72.141.88.185.50292: Flags [P.], seq 4344:4548, ack 1, win 501, options [nop,nop,TS val 2498773132 ecr 1228093362], length 204
01:43:12.306237 IP 147.182.157.116.22 > 72.141.88.185.50292: Flags [P.], seq 4548:4584, ack 1, win 501, options [nop,nop,TS val 2498773132 ecr 1228093362], length 36
01:43:12.306326 IP 147.182.157.116.22 > 72.141.88.185.50292: Flags [P.], seq 4584:4788, ack 1, win 501, options [nop,nop,TS val 2498773132 ecr 1228093362], length 204
01:43:12.306391 IP 147.182.157.116.22 > 72.141.88.185.50292: Flags [P.], seq 4788:4824, ack 1, win 501, options [nop,nop,TS val 2498773132 ecr 1228093362], length 36
01:43:12.306450 IP 147.182.157.116.22 > 72.141.88.185.50292: Flags [P.], seq 4824:5028, ack 1, win 501, options [nop,nop,TS val 2498773132 ecr 1228093362], length 204
01:43:12.311874 IP 72.141.88.185.50292 > 147.182.157.116.22: Flags [.], ack 2472, win 32744, options [nop,nop,TS val 1228093370 ecr 2498773125], length 0
01:43:12.311919 IP 147.182.157.116.22 > 72.141.88.185.50292: Flags [P.], seq 5028:7704, ack 1, win 501, options [nop,nop,TS val 2498773137 ecr 1228093370], length 2676
01:43:12.312068 IP 147.182.157.116.22 > 72.141.88.185.50292: Flags [P.], seq 7704:7892, ack 1, win 501, options [nop,nop,TS val 2498773137 ecr 1228093370], length 188
01:43:12.312118 IP 147.182.157.116.22 > 72.141.88.185.50292: Flags [P.], seq 7892:7928, ack 1, win 501, options [nop,nop,TS val 2498773137 ecr 1228093370], length 36
01:43:12.318578 IP 72.141.88.185.50292 > 147.182.157.116.22: Flags [.], ack 2936, win 32760, options [nop,nop,TS val 1228093375 ecr 2498773131], length 0
01:43:12.318629 IP 147.182.157.116.22 > 72.141.88.185.50292: Flags [P.], seq 7928:8648, ack 1, win 501, options [nop,nop,TS val 2498773144 ecr 1228093375], length 720
01:43:12.318795 IP 147.182.157.116.22 > 72.141.88.185.50292: Flags [P.], seq 8648:8836, ack 1, win 501, options [nop,nop,TS val 2498773144 ecr 1228093375], length 188
01:43:12.324612 IP 72.141.88.185.50292 > 147.182.157.116.22: Flags [.], ack 4104, win 32763, options [nop,nop,TS val 1228093375 ecr 2498773131], length 0
01:43:12.324613 IP 72.141.88.185.50292 > 147.182.157.116.22: Flags [.], ack 5028, win 32764, options [nop,nop,TS val 1228093375 ecr 2498773132], length 0
01:43:12.324613 IP 72.141.88.185.50292 > 147.182.157.116.22: Flags [.], ack 7704, win 32726, options [nop,nop,TS val 1228093381 ecr 2498773137], length 0
01:43:12.324613 IP 72.141.88.185.50292 > 147.182.157.116.22: Flags [.], ack 7928, win 32722, options [nop,nop,TS val 1228093381 ecr 2498773137], length 0
01:43:12.324613 IP 72.141.88.185.50292 > 147.182.157.116.22: Flags [.], ack 7928, win 32768, options [nop,nop,TS val 1228093381 ecr 2498773137], length 0
01:43:12.324689 IP 147.182.157.116.22 > 72.141.88.185.50292: Flags [P.], seq 8836:9352, ack 1, win 501, options [nop,nop,TS val 2498773150 ecr 1228093375], length 516
01:43:12.324885 IP 147.182.157.116.22 > 72.141.88.185.50292: Flags [P.], seq 9352:9540, ack 1, win 501, options [nop,nop,TS val 2498773150 ecr 1228093381], length 188
01:43:12.324963 IP 147.182.157.116.22 > 72.141.88.185.50292: Flags [P.], seq 9540:9576, ack 1, win 501, options [nop,nop,TS val 2498773150 ecr 1228093381], length 36
01:43:12.325048 IP 147.182.157.116.22 > 72.141.88.185.50292: Flags [P.], seq 9576:9764, ack 1, win 501, options [nop,nop,TS val 2498773150 ecr 1228093381], length 188
01:43:12.325113 IP 147.182.157.116.22 > 72.141.88.185.50292: Flags [P.], seq 9764:9800, ack 1, win 501, options [nop,nop,TS val 2498773150 ecr 1228093381], length 36
01:43:12.325219 IP 147.182.157.116.22 > 72.141.88.185.50292: Flags [P.], seq 9800:9988, ack 1, win 501, options [nop,nop,TS val 2498773151 ecr 1228093381], length 188
01:43:12.325276 IP 147.182.157.116.22 > 72.141.88.185.50292: Flags [P.], seq 9988:10024, ack 1, win 501, options [nop,nop,TS val 2498773151 ecr 1228093381], length 36
01:43:12.325352 IP 147.182.157.116.22 > 72.141.88.185.50292: Flags [P.], seq 10024:10212, ack 1, win 501, options [nop,nop,TS val 2498773151 ecr 1228093381], length 188
01:43:12.325445 IP 147.182.157.116.22 > 72.141.88.185.50292: Flags [P.], seq 10212:10248, ack 1, win 501, options [nop,nop,TS val 2498773151 ecr 1228093381], length 36
01:43:12.325498 IP 147.182.157.116.22 > 72.141.88.185.50292: Flags [P.], seq 10248:10436, ack 1, win 501, options [nop,nop,TS val 2498773151 ecr 1228093381], length 188
01:43:12.325558 IP 147.182.157.116.22 > 72.141.88.185.50292: Flags [P.], seq 10436:10472, ack 1, win 501, options [nop,nop,TS val 2498773151 ecr 1228093381], length 36
01:43:12.325642 IP 147.182.157.116.22 > 72.141.88.185.50292: Flags [P.], seq 10472:10676, ack 1, win 501, options [nop,nop,TS val 2498773151 ecr 1228093381], length 204
01:43:12.325708 IP 147.182.157.116.22 > 72.141.88.185.50292: Flags [P.], seq 10676:10712, ack 1, win 501, options [nop,nop,TS val 2498773151 ecr 1228093381], length 36
01:43:12.325754 IP 147.182.157.116.22 > 72.141.88.185.50292: Flags [P.], seq 10712:10916, ack 1, win 501, options [nop,nop,TS val 2498773151 ecr 1228093381], length 204
01:43:12.325795 IP 147.182.157.116.22 > 72.141.88.185.50292: Flags [P.], seq 10916:10952, ack 1, win 501, options [nop,nop,TS val 2498773151 ecr 1228093381], length 36
01:43:12.325847 IP 147.182.157.116.22 > 72.141.88.185.50292: Flags [P.], seq 10952:11156, ack 1, win 501, options [nop,nop,TS val 2498773151 ecr 1228093381], length 204
01:43:12.325886 IP 147.182.157.116.22 > 72.141.88.185.50292: Flags [P.], seq 11156:11192, ack 1, win 501, options [nop,nop,TS val 2498773151 ecr 1228093381], length 36
01:43:12.325938 IP 147.182.157.116.22 > 72.141.88.185.50292: Flags [P.], seq 11192:11396, ack 1, win 501, options [nop,nop,TS val 2498773151 ecr 1228093381], length 204
01:43:12.325978 IP 147.182.157.116.22 > 72.141.88.185.50292: Flags [P.], seq 11396:11432, ack 1, win 501, options [nop,nop,TS val 2498773151 ecr 1228093381], length 36
01:43:12.326029 IP 147.182.157.116.22 > 72.141.88.185.50292: Flags [P.], seq 11432:11636, ack 1, win 501, options [nop,nop,TS val 2498773151 ecr 1228093381], length 204
01:43:12.326071 IP 147.182.157.116.22 > 72.141.88.185.50292: Flags [P.], seq 11636:11672, ack 1, win 501, options [nop,nop,TS val 2498773151 ecr 1228093381], length 36
01:43:12.326122 IP 147.182.157.116.22 > 72.141.88.185.50292: Flags [P.], seq 11672:11876, ack 1, win 501, options [nop,nop,TS val 2498773151 ecr 1228093381], length 204
01:43:12.326161 IP 147.182.157.116.22 > 72.141.88.185.50292: Flags [P.], seq 11876:11912, ack 1, win 501, options [nop,nop,TS val 2498773152 ecr 1228093381], length 36
01:43:12.326211 IP 147.182.157.116.22 > 72.141.88.185.50292: Flags [P.], seq 11912:12116, ack 1, win 501, options [nop,nop,TS val 2498773152 ecr 1228093381], length 204
01:43:12.326303 IP 147.182.157.116.22 > 72.141.88.185.50292: Flags [P.], seq 12116:12152, ack 1, win 501, options [nop,nop,TS val 2498773152 ecr 1228093381], length 36
01:43:12.326380 IP 147.182.157.116.22 > 72.141.88.185.50292: Flags [P.], seq 12152:12356, ack 1, win 501, options [nop,nop,TS val 2498773152 ecr 1228093381], length 204
01:43:12.326444 IP 147.182.157.116.22 > 72.141.88.185.50292: Flags [P.], seq 12356:12596, ack 1, win 501, options [nop,nop,TS val 2498773152 ecr 1228093381], length 240
01:43:12.326538 IP 147.182.157.116.22 > 72.141.88.185.50292: Flags [P.], seq 12596:12632, ack 1, win 501, options [nop,nop,TS val 2498773152 ecr 1228093381], length 36
01:43:12.326585 IP 147.182.157.116.22 > 72.141.88.185.50292: Flags [P.], seq 12632:12836, ack 1, win 501, options [nop,nop,TS val 2498773152 ecr 1228093381], length 204
01:43:12.326646 IP 147.182.157.116.22 > 72.141.88.185.50292: Flags [P.], seq 12836:12872, ack 1, win 501, options [nop,nop,TS val 2498773152 ecr 1228093381], length 36
01:43:12.326707 IP 147.182.157.116.22 > 72.141.88.185.50292: Flags [P.], seq 12872:13076, ack 1, win 501, options [nop,nop,TS val 2498773152 ecr 1228093381], length 204
01:43:12.326747 IP 147.182.157.116.22 > 72.141.88.185.50292: Flags [P.], seq 13076:13112, ack 1, win 501, options [nop,nop,TS val 2498773152 ecr 1228093381], length 36
01:43:12.326799 IP 147.182.157.116.22 > 72.141.88.185.50292: Flags [P.], seq 13112:13316, ack 1, win 501, options [nop,nop,TS val 2498773152 ecr 1228093381], length 204
01:43:12.326837 IP 147.182.157.116.22 > 72.141.88.185.50292: Flags [P.], seq 13316:13352, ack 1, win 501, options [nop,nop,TS val 2498773152 ecr 1228093381], length 36
01:43:12.326889 IP 147.182.157.116.22 > 72.141.88.185.50292: Flags [P.], seq 13352:13556, ack 1, win 501, options [nop,nop,TS val 2498773152 ecr 1228093381], length 204
01:43:12.326929 IP 147.182.157.116.22 > 72.141.88.185.50292: Flags [P.], seq 13556:13592, ack 1, win 501, options [nop,nop,TS val 2498773152 ecr 1228093381], length 36
01:43:12.326979 IP 147.182.157.116.22 > 72.141.88.185.50292: Flags [P.], seq 13592:13796, ack 1, win 501, options [nop,nop,TS val 2498773152 ecr 1228093381], length 204
01:43:12.327019 IP 147.182.157.116.22 > 72.141.88.185.50292: Flags [P.], seq 13796:13832, ack 1, win 501, options [nop,nop,TS val 2498773152 ecr 1228093381], length 36
01:43:12.327070 IP 147.182.157.116.22 > 72.141.88.185.50292: Flags [P.], seq 13832:14036, ack 1, win 501, options [nop,nop,TS val 2498773152 ecr 1228093381], length 204
01:43:12.327109 IP 147.182.157.116.22 > 72.141.88.185.50292: Flags [P.], seq 14036:14072, ack 1, win 501, options [nop,nop,TS val 2498773152 ecr 1228093381], length 36
01:43:12.327159 IP 147.182.157.116.22 > 72.141.88.185.50292: Flags [P.], seq 14072:14276, ack 1, win 501, options [nop,nop,TS val 2498773153 ecr 1228093381], length 204
01:43:12.327199 IP 147.182.157.116.22 > 72.141.88.185.50292: Flags [P.], seq 14276:14312, ack 1, win 501, options [nop,nop,TS val 2498773153 ecr 1228093381], length 36
01:43:12.333313 IP 72.141.88.185.50292 > 147.182.157.116.22: Flags [.], ack 8648, win 32756, options [nop,nop,TS val 1228093388 ecr 2498773144], length 0
01:43:12.333403 IP 147.182.157.116.22 > 72.141.88.185.50292: Flags [P.], seq 14312:17208, ack 1, win 501, options [nop,nop,TS val 2498773159 ecr 1228093388], length 2896
01:43:12.341528 IP 72.141.88.185.50292 > 147.182.157.116.22: Flags [.], ack 8836, win 32753, options [nop,nop,TS val 1228093388 ecr 2498773144], length 0
01:43:12.341528 IP 72.141.88.185.50292 > 147.182.157.116.22: Flags [.], ack 9352, win 32759, options [nop,nop,TS val 1228093393 ecr 2498773150], length 0
01:43:12.341528 IP 72.141.88.185.50292 > 147.182.157.116.22: Flags [.], ack 9540, win 32765, options [nop,nop,TS val 1228093394 ecr 2498773150], length 0
01:43:12.341596 IP 147.182.157.116.22 > 72.141.88.185.50292: Flags [P.], seq 17208:20104, ack 1, win 501, options [nop,nop,TS val 2498773167 ecr 1228093388], length 2896
01:43:12.341619 IP 147.182.157.116.22 > 72.141.88.185.50292: Flags [P.], seq 20104:21016, ack 1, win 501, options [nop,nop,TS val 2498773167 ecr 1228093393], length 912
01:43:12.341643 IP 72.141.88.185.50292 > 147.182.157.116.22: Flags [.], ack 10676, win 32761, options [nop,nop,TS val 1228093394 ecr 2498773151], length 0
01:43:12.341680 IP 72.141.88.185.50292 > 147.182.157.116.22: Flags [.], ack 11876, win 32756, options [nop,nop,TS val 1228093394 ecr 2498773151], length 0
01:43:12.341680 IP 72.141.88.185.50292 > 147.182.157.116.22: Flags [.], ack 12872, win 32767, options [nop,nop,TS val 1228093395 ecr 2498773152], length 0
01:43:12.341828 IP 147.182.157.116.22 > 72.141.88.185.50292: Flags [P.], seq 21016:21204, ack 1, win 501, options [nop,nop,TS val 2498773167 ecr 1228093395], length 188
01:43:12.341886 IP 147.182.157.116.22 > 72.141.88.185.50292: Flags [P.], seq 21204:21240, ack 1, win 501, options [nop,nop,TS val 2498773167 ecr 1228093395], length 36
01:43:12.341944 IP 147.182.157.116.22 > 72.141.88.185.50292: Flags [P.], seq 21240:21428, ack 1, win 501, options [nop,nop,TS val 2498773167 ecr 1228093395], length 188
01:43:12.341988 IP 147.182.157.116.22 > 72.141.88.185.50292: Flags [P.], seq 21428:21464, ack 1, win 501, options [nop,nop,TS val 2498773167 ecr 1228093395], length 36
01:43:12.342040 IP 147.182.157.116.22 > 72.141.88.185.50292: Flags [P.], seq 21464:21652, ack 1, win 501, options [nop,nop,TS val 2498773167 ecr 1228093395], length 188
01:43:12.342082 IP 147.182.157.116.22 > 72.141.88.185.50292: Flags [P.], seq 21652:21688, ack 1, win 501, options [nop,nop,TS val 2498773167 ecr 1228093395], length 36
01:43:12.342134 IP 147.182.157.116.22 > 72.141.88.185.50292: Flags [P.], seq 21688:21892, ack 1, win 501, options [nop,nop,TS val 2498773168 ecr 1228093395], length 204
01:43:12.342175 IP 147.182.157.116.22 > 72.141.88.185.50292: Flags [P.], seq 21892:21928, ack 1, win 501, options [nop,nop,TS val 2498773168 ecr 1228093395], length 36
01:43:12.342254 IP 147.182.157.116.22 > 72.141.88.185.50292: Flags [P.], seq 21928:22132, ack 1, win 501, options [nop,nop,TS val 2498773168 ecr 1228093395], length 204
01:43:12.342327 IP 147.182.157.116.22 > 72.141.88.185.50292: Flags [P.], seq 22132:22168, ack 1, win 501, options [nop,nop,TS val 2498773168 ecr 1228093395], length 36
01:43:12.342401 IP 147.182.157.116.22 > 72.141.88.185.50292: Flags [P.], seq 22168:22356, ack 1, win 501, options [nop,nop,TS val 2498773168 ecr 1228093395], length 188
01:43:12.342444 IP 147.182.157.116.22 > 72.141.88.185.50292: Flags [P.], seq 22356:22392, ack 1, win 501, options [nop,nop,TS val 2498773168 ecr 1228093395], length 36
01:43:12.342497 IP 147.182.157.116.22 > 72.141.88.185.50292: Flags [P.], seq 22392:22580, ack 1, win 501, options [nop,nop,TS val 2498773168 ecr 1228093395], length 188
01:43:12.342538 IP 147.182.157.116.22 > 72.141.88.185.50292: Flags [P.], seq 22580:22616, ack 1, win 501, options [nop,nop,TS val 2498773168 ecr 1228093395], length 36
01:43:12.342589 IP 147.182.157.116.22 > 72.141.88.185.50292: Flags [P.], seq 22616:22804, ack 1, win 501, options [nop,nop,TS val 2498773168 ecr 1228093395], length 188
01:43:12.342628 IP 147.182.157.116.22 > 72.141.88.185.50292: Flags [P.], seq 22804:22840, ack 1, win 501, options [nop,nop,TS val 2498773168 ecr 1228093395], length 36
01:43:12.342679 IP 147.182.157.116.22 > 72.141.88.185.50292: Flags [P.], seq 22840:23044, ack 1, win 501, options [nop,nop,TS val 2498773168 ecr 1228093395], length 204
01:43:12.342719 IP 147.182.157.116.22 > 72.141.88.185.50292: Flags [P.], seq 23044:23080, ack 1, win 501, options [nop,nop,TS val 2498773168 ecr 1228093395], length 36
01:43:12.342770 IP 147.182.157.116.22 > 72.141.88.185.50292: Flags [P.], seq 23080:23284, ack 1, win 501, options [nop,nop,TS val 2498773168 ecr 1228093395], length 204
01:43:12.342810 IP 147.182.157.116.22 > 72.141.88.185.50292: Flags [P.], seq 23284:23320, ack 1, win 501, options [nop,nop,TS val 2498773168 ecr 1228093395], length 36
01:43:12.342862 IP 147.182.157.116.22 > 72.141.88.185.50292: Flags [P.], seq 23320:23524, ack 1, win 501, options [nop,nop,TS val 2498773168 ecr 1228093395], length 204
01:43:12.342901 IP 147.182.157.116.22 > 72.141.88.185.50292: Flags [P.], seq 23524:23560, ack 1, win 501, options [nop,nop,TS val 2498773168 ecr 1228093395], length 36
01:43:12.342952 IP 147.182.157.116.22 > 72.141.88.185.50292: Flags [P.], seq 23560:23764, ack 1, win 501, options [nop,nop,TS val 2498773168 ecr 1228093395], length 204
01:43:12.342993 IP 147.182.157.116.22 > 72.141.88.185.50292: Flags [P.], seq 23764:23800, ack 1, win 501, options [nop,nop,TS val 2498773168 ecr 1228093395], length 36
01:43:12.343044 IP 147.182.157.116.22 > 72.141.88.185.50292: Flags [P.], seq 23800:24004, ack 1, win 501, options [nop,nop,TS val 2498773168 ecr 1228093395], length 204
01:43:12.343085 IP 147.182.157.116.22 > 72.141.88.185.50292: Flags [P.], seq 24004:24040, ack 1, win 501, options [nop,nop,TS val 2498773168 ecr 1228093395], length 36
01:43:12.343150 IP 147.182.157.116.22 > 72.141.88.185.50292: Flags [P.], seq 24040:24244, ack 1, win 501, options [nop,nop,TS val 2498773169 ecr 1228093395], length 204
01:43:12.343190 IP 147.182.157.116.22 > 72.141.88.185.50292: Flags [P.], seq 24244:24280, ack 1, win 501, options [nop,nop,TS val 2498773169 ecr 1228093395], length 36
01:43:12.343241 IP 147.182.157.116.22 > 72.141.88.185.50292: Flags [P.], seq 24280:24484, ack 1, win 501, options [nop,nop,TS val 2498773169 ecr 1228093395], length 204
01:43:12.343325 IP 147.182.157.116.22 > 72.141.88.185.50292: Flags [P.], seq 24484:24520, ack 1, win 501, options [nop,nop,TS val 2498773169 ecr 1228093395], length 36
01:43:12.343385 IP 147.182.157.116.22 > 72.141.88.185.50292: Flags [P.], seq 24520:24724, ack 1, win 501, options [nop,nop,TS val 2498773169 ecr 1228093395], length 204
01:43:12.343427 IP 147.182.157.116.22 > 72.141.88.185.50292: Flags [P.], seq 24724:24760, ack 1, win 501, options [nop,nop,TS val 2498773169 ecr 1228093395], length 36
01:43:12.343482 IP 147.182.157.116.22 > 72.141.88.185.50292: Flags [P.], seq 24760:24964, ack 1, win 501, options [nop,nop,TS val 2498773169 ecr 1228093395], length 204
01:43:12.343523 IP 147.182.157.116.22 > 72.141.88.185.50292: Flags [P.], seq 24964:25000, ack 1, win 501, options [nop,nop,TS val 2498773169 ecr 1228093395], length 36
01:43:12.343574 IP 147.182.157.116.22 > 72.141.88.185.50292: Flags [P.], seq 25000:25204, ack 1, win 501, options [nop,nop,TS val 2498773169 ecr 1228093395], length 204
01:43:12.343629 IP 147.182.157.116.22 > 72.141.88.185.50292: Flags [P.], seq 25204:25240, ack 1, win 501, options [nop,nop,TS val 2498773169 ecr 1228093395], length 36
01:43:12.343681 IP 147.182.157.116.22 > 72.141.88.185.50292: Flags [P.], seq 25240:25444, ack 1, win 501, options [nop,nop,TS val 2498773169 ecr 1228093395], length 204
01:43:12.343721 IP 147.182.157.116.22 > 72.141.88.185.50292: Flags [P.], seq 25444:25480, ack 1, win 501, options [nop,nop,TS val 2498773169 ecr 1228093395], length 36
01:43:12.343774 IP 147.182.157.116.22 > 72.141.88.185.50292: Flags [P.], seq 25480:25684, ack 1, win 501, options [nop,nop,TS val 2498773169 ecr 1228093395], length 204
01:43:12.343813 IP 147.182.157.116.22 > 72.141.88.185.50292: Flags [P.], seq 25684:25720, ack 1, win 501, options [nop,nop,TS val 2498773169 ecr 1228093395], length 36
01:43:12.343863 IP 147.182.157.116.22 > 72.141.88.185.50292: Flags [P.], seq 25720:25924, ack 1, win 501, options [nop,nop,TS val 2498773169 ecr 1228093395], length 204
01:43:12.343937 IP 147.182.157.116.22 > 72.141.88.185.50292: Flags [P.], seq 25924:26304, ack 1, win 501, options [nop,nop,TS val 2498773169 ecr 1228093395], length 380
01:43:12.344031 IP 147.182.157.116.22 > 72.141.88.185.50292: Flags [P.], seq 26304:27188, ack 1, win 501, options [nop,nop,TS val 2498773169 ecr 1228093395], length 884
01:43:12.344126 IP 147.182.157.116.22 > 72.141.88.185.50292: Flags [P.], seq 27188:28072, ack 1, win 501, options [nop,nop,TS val 2498773170 ecr 1228093395], length 884
01:43:12.344224 IP 147.182.157.116.22 > 72.141.88.185.50292: Flags [P.], seq 28072:28956, ack 1, win 501, options [nop,nop,TS val 2498773170 ecr 1228093395], length 884
01:43:12.344315 IP 147.182.157.116.22 > 72.141.88.185.50292: Flags [P.], seq 28956:29840, ack 1, win 501, options [nop,nop,TS val 2498773170 ecr 1228093395], length 884
01:43:12.344462 IP 147.182.157.116.22 > 72.141.88.185.50292: Flags [P.], seq 29840:31068, ack 1, win 501, options [nop,nop,TS val 2498773170 ecr 1228093395], length 1228
01:43:12.344575 IP 147.182.157.116.22 > 72.141.88.185.50292: Flags [P.], seq 31068:31960, ack 1, win 501, options [nop,nop,TS val 2498773170 ecr 1228093395], length 892
01:43:12.344641 IP 147.182.157.116.22 > 72.141.88.185.50292: Flags [P.], seq 31960:32164, ack 1, win 501, options [nop,nop,TS val 2498773170 ecr 1228093395], length 204
01:43:12.344702 IP 147.182.157.116.22 > 72.141.88.185.50292: Flags [P.], seq 32164:32368, ack 1, win 501, options [nop,nop,TS val 2498773170 ecr 1228093395], length 204
01:43:12.344764 IP 147.182.157.116.22 > 72.141.88.185.50292: Flags [P.], seq 32368:32572, ack 1, win 501, options [nop,nop,TS val 2498773170 ecr 1228093395], length 204
01:43:12.344837 IP 147.182.157.116.22 > 72.141.88.185.50292: Flags [P.], seq 32572:32776, ack 1, win 501, options [nop,nop,TS val 2498773170 ecr 1228093395], length 204
01:43:12.344898 IP 147.182.157.116.22 > 72.141.88.185.50292: Flags [P.], seq 32776:32980, ack 1, win 501, options [nop,nop,TS val 2498773170 ecr 1228093395], length 204
01:43:12.344967 IP 147.182.157.116.22 > 72.141.88.185.50292: Flags [P.], seq 32980:33184, ack 1, win 501, options [nop,nop,TS val 2498773170 ecr 1228093395], length 204
01:43:12.345028 IP 147.182.157.116.22 > 72.141.88.185.50292: Flags [P.], seq 33184:33388, ack 1, win 501, options [nop,nop,TS val 2498773170 ecr 1228093395], length 204
01:43:12.345092 IP 147.182.157.116.22 > 72.141.88.185.50292: Flags [P.], seq 33388:33592, ack 1, win 501, options [nop,nop,TS val 2498773170 ecr 1228093395], length 204
01:43:12.345155 IP 147.182.157.116.22 > 72.141.88.185.50292: Flags [P.], seq 33592:33796, ack 1, win 501, options [nop,nop,TS val 2498773171 ecr 1228093395], length 204
01:43:12.345234 IP 147.182.157.116.22 > 72.141.88.185.50292: Flags [P.], seq 33796:34000, ack 1, win 501, options [nop,nop,TS val 2498773171 ecr 1228093395], length 204
01:43:12.345341 IP 147.182.157.116.22 > 72.141.88.185.50292: Flags [P.], seq 34000:34204, ack 1, win 501, options [nop,nop,TS val 2498773171 ecr 1228093395], length 204
01:43:12.346671 IP 72.141.88.185.50292 > 147.182.157.116.22: Flags [.], ack 14072, win 32767, options [nop,nop,TS val 1228093395 ecr 2498773152], length 0
01:43:12.346672 IP 72.141.88.185.50292 > 147.182.157.116.22: Flags [.], ack 14312, win 32763, options [nop,nop,TS val 1228093395 ecr 2498773153], length 0
01:43:12.346672 IP 72.141.88.185.50292 > 147.182.157.116.22: Flags [.], ack 17208, win 32745, options [nop,nop,TS val 1228093400 ecr 2498773159], length 0
01:43:12.346712 IP 147.182.157.116.22 > 72.141.88.185.50292: Flags [P.], seq 34204:34408, ack 1, win 501, options [nop,nop,TS val 2498773172 ecr 1228093395], length 204
01:43:12.346910 IP 147.182.157.116.22 > 72.141.88.185.50292: Flags [P.], seq 34408:35084, ack 1, win 501, options [nop,nop,TS val 2498773172 ecr 1228093400], length 676
01:43:12.346995 IP 147.182.157.116.22 > 72.141.88.185.50292: Flags [P.], seq 35084:35288, ack 1, win 501, options [nop,nop,TS val 2498773172 ecr 1228093400], length 204
01:43:12.347060 IP 147.182.157.116.22 > 72.141.88.185.50292: Flags [P.], seq 35288:35492, ack 1, win 501, options [nop,nop,TS val 2498773172 ecr 1228093400], length 204
01:43:12.347121 IP 147.182.157.116.22 > 72.141.88.185.50292: Flags [P.], seq 35492:35696, ack 1, win 501, options [nop,nop,TS val 2498773172 ecr 1228093400], length 204
01:43:12.347183 IP 147.182.157.116.22 > 72.141.88.185.50292: Flags [P.], seq 35696:35900, ack 1, win 501, options [nop,nop,TS val 2498773173 ecr 1228093400], length 204
01:43:12.347246 IP 147.182.157.116.22 > 72.141.88.185.50292: Flags [P.], seq 35900:36104, ack 1, win 501, options [nop,nop,TS val 2498773173 ecr 1228093400], length 204
01:43:12.347317 IP 147.182.157.116.22 > 72.141.88.185.50292: Flags [P.], seq 36104:36308, ack 1, win 501, options [nop,nop,TS val 2498773173 ecr 1228093400], length 204
01:43:12.347379 IP 147.182.157.116.22 > 72.141.88.185.50292: Flags [P.], seq 36308:36512, ack 1, win 501, options [nop,nop,TS val 2498773173 ecr 1228093400], length 204
01:43:12.347440 IP 147.182.157.116.22 > 72.141.88.185.50292: Flags [P.], seq 36512:36716, ack 1, win 501, options [nop,nop,TS val 2498773173 ecr 1228093400], length 204
01:43:12.347501 IP 147.182.157.116.22 > 72.141.88.185.50292: Flags [P.], seq 36716:36920, ack 1, win 501, options [nop,nop,TS val 2498773173 ecr 1228093400], length 204
01:43:12.347560 IP 147.182.157.116.22 > 72.141.88.185.50292: Flags [P.], seq 36920:37124, ack 1, win 501, options [nop,nop,TS val 2498773173 ecr 1228093400], length 204
01:43:12.347620 IP 147.182.157.116.22 > 72.141.88.185.50292: Flags [P.], seq 37124:37328, ack 1, win 501, options [nop,nop,TS val 2498773173 ecr 1228093400], length 204
01:43:12.347680 IP 147.182.157.116.22 > 72.141.88.185.50292: Flags [P.], seq 37328:37532, ack 1, win 501, options [nop,nop,TS val 2498773173 ecr 1228093400], length 204
01:43:12.347739 IP 147.182.157.116.22 > 72.141.88.185.50292: Flags [P.], seq 37532:37736, ack 1, win 501, options [nop,nop,TS val 2498773173 ecr 1228093400], length 204
01:43:12.347809 IP 147.182.157.116.22 > 72.141.88.185.50292: Flags [P.], seq 37736:37940, ack 1, win 501, options [nop,nop,TS val 2498773173 ecr 1228093400], length 204
01:43:12.347871 IP 147.182.157.116.22 > 72.141.88.185.50292: Flags [P.], seq 37940:38144, ack 1, win 501, options [nop,nop,TS val 2498773173 ecr 1228093400], length 204
01:43:12.347930 IP 147.182.157.116.22 > 72.141.88.185.50292: Flags [P.], seq 38144:38348, ack 1, win 501, options [nop,nop,TS val 2498773173 ecr 1228093400], length 204
01:43:12.347991 IP 147.182.157.116.22 > 72.141.88.185.50292: Flags [P.], seq 38348:38552, ack 1, win 501, options [nop,nop,TS val 2498773173 ecr 1228093400], length 204
01:43:12.348052 IP 147.182.157.116.22 > 72.141.88.185.50292: Flags [P.], seq 38552:38756, ack 1, win 501, options [nop,nop,TS val 2498773173 ecr 1228093400], length 204
01:43:12.348113 IP 147.182.157.116.22 > 72.141.88.185.50292: Flags [P.], seq 38756:38960, ack 1, win 501, options [nop,nop,TS val 2498773173 ecr 1228093400], length 204
01:43:12.348174 IP 147.182.157.116.22 > 72.141.88.185.50292: Flags [P.], seq 38960:39164, ack 1, win 501, options [nop,nop,TS val 2498773174 ecr 1228093400], length 204
01:43:12.348235 IP 147.182.157.116.22 > 72.141.88.185.50292: Flags [P.], seq 39164:39368, ack 1, win 501, options [nop,nop,TS val 2498773174 ecr 1228093400], length 204
01:43:12.348303 IP 147.182.157.116.22 > 72.141.88.185.50292: Flags [P.], seq 39368:39572, ack 1, win 501, options [nop,nop,TS val 2498773174 ecr 1228093400], length 204
01:43:12.348364 IP 147.182.157.116.22 > 72.141.88.185.50292: Flags [P.], seq 39572:39776, ack 1, win 501, options [nop,nop,TS val 2498773174 ecr 1228093400], length 204
01:43:12.348425 IP 147.182.157.116.22 > 72.141.88.185.50292: Flags [P.], seq 39776:39980, ack 1, win 501, options [nop,nop,TS val 2498773174 ecr 1228093400], length 204
01:43:12.348483 IP 147.182.157.116.22 > 72.141.88.185.50292: Flags [P.], seq 39980:40184, ack 1, win 501, options [nop,nop,TS val 2498773174 ecr 1228093400], length 204
01:43:12.348542 IP 147.182.157.116.22 > 72.141.88.185.50292: Flags [P.], seq 40184:40388, ack 1, win 501, options [nop,nop,TS val 2498773174 ecr 1228093400], length 204
01:43:12.349810 IP 72.141.88.185.50292 > 147.182.157.116.22: Flags [.], ack 20104, win 32722, options [nop,nop,TS val 1228093409 ecr 2498773167], length 0
01:43:12.349810 IP 72.141.88.185.50292 > 147.182.157.116.22: Flags [.], ack 21428, win 32702, options [nop,nop,TS val 1228093409 ecr 2498773167], length 0
01:43:12.349835 IP 147.182.157.116.22 > 72.141.88.185.50292: Flags [P.], seq 40388:40592, ack 1, win 501, options [nop,nop,TS val 2498773175 ecr 1228093409], length 204
01:43:12.349946 IP 147.182.157.116.22 > 72.141.88.185.50292: Flags [P.], seq 40592:41108, ack 1, win 501, options [nop,nop,TS val 2498773175 ecr 1228093409], length 516
01:43:12.350012 IP 147.182.157.116.22 > 72.141.88.185.50292: Flags [P.], seq 41108:41312, ack 1, win 501, options [nop,nop,TS val 2498773175 ecr 1228093409], length 204
01:43:12.350092 IP 147.182.157.116.22 > 72.141.88.185.50292: Flags [P.], seq 41312:41516, ack 1, win 501, options [nop,nop,TS val 2498773175 ecr 1228093409], length 204
01:43:12.350158 IP 147.182.157.116.22 > 72.141.88.185.50292: Flags [P.], seq 41516:41720, ack 1, win 501, options [nop,nop,TS val 2498773176 ecr 1228093409], length 204
01:43:12.350238 IP 147.182.157.116.22 > 72.141.88.185.50292: Flags [P.], seq 41720:41924, ack 1, win 501, options [nop,nop,TS val 2498773176 ecr 1228093409], length 204
01:43:12.350340 IP 147.182.157.116.22 > 72.141.88.185.50292: Flags [P.], seq 41924:42128, ack 1, win 501, options [nop,nop,TS val 2498773176 ecr 1228093409], length 204
01:43:12.350443 IP 147.182.157.116.22 > 72.141.88.185.50292: Flags [P.], seq 42128:42332, ack 1, win 501, options [nop,nop,TS val 2498773176 ecr 1228093409], length 204
01:43:12.350532 IP 147.182.157.116.22 > 72.141.88.185.50292: Flags [P.], seq 42332:42536, ack 1, win 501, options [nop,nop,TS val 2498773176 ecr 1228093409], length 204
01:43:12.350598 IP 147.182.157.116.22 > 72.141.88.185.50292: Flags [P.], seq 42536:42740, ack 1, win 501, options [nop,nop,TS val 2498773176 ecr 1228093409], length 204
01:43:12.350661 IP 147.182.157.116.22 > 72.141.88.185.50292: Flags [P.], seq 42740:42944, ack 1, win 501, options [nop,nop,TS val 2498773176 ecr 1228093409], length 204
01:43:12.350735 IP 147.182.157.116.22 > 72.141.88.185.50292: Flags [P.], seq 42944:43148, ack 1, win 501, options [nop,nop,TS val 2498773176 ecr 1228093409], length 204
01:43:12.358250 IP 72.141.88.185.50292 > 147.182.157.116.22: Flags [.], ack 21428, win 32768, options [nop,nop,TS val 1228093409 ecr 2498773167], length 0
01:43:12.358251 IP 72.141.88.185.50292 > 147.182.157.116.22: Flags [.], ack 22580, win 32750, options [nop,nop,TS val 1228093409 ecr 2498773168], length 0
01:43:12.358251 IP 72.141.88.185.50292 > 147.182.157.116.22: Flags [.], ack 23764, win 32731, options [nop,nop,TS val 1228093409 ecr 2498773168], length 0
01:43:12.358251 IP 72.141.88.185.50292 > 147.182.157.116.22: Flags [.], ack 24244, win 32724, options [nop,nop,TS val 1228093409 ecr 2498773169], length 0
01:43:12.358251 IP 72.141.88.185.50292 > 147.182.157.116.22: Flags [.], ack 24280, win 32767, options [nop,nop,TS val 1228093410 ecr 2498773169], length 0
01:43:12.358339 IP 147.182.157.116.22 > 72.141.88.185.50292: Flags [P.], seq 43148:43352, ack 1, win 501, options [nop,nop,TS val 2498773184 ecr 1228093409], length 204
01:43:12.358605 IP 147.182.157.116.22 > 72.141.88.185.50292: Flags [P.], seq 43352:44340, ack 1, win 501, options [nop,nop,TS val 2498773184 ecr 1228093410], length 988
01:43:12.358682 IP 147.182.157.116.22 > 72.141.88.185.50292: Flags [P.], seq 44340:44544, ack 1, win 501, options [nop,nop,TS val 2498773184 ecr 1228093410], length 204
01:43:12.358777 IP 147.182.157.116.22 > 72.141.88.185.50292: Flags [P.], seq 44544:44748, ack 1, win 501, options [nop,nop,TS val 2498773184 ecr 1228093410], length 204
01:43:12.358859 IP 147.182.157.116.22 > 72.141.88.185.50292: Flags [P.], seq 44748:44952, ack 1, win 501, options [nop,nop,TS val 2498773184 ecr 1228093410], length 204
01:43:12.358923 IP 147.182.157.116.22 > 72.141.88.185.50292: Flags [P.], seq 44952:45156, ack 1, win 501, options [nop,nop,TS val 2498773184 ecr 1228093410], length 204
01:43:12.358985 IP 147.182.157.116.22 > 72.141.88.185.50292: Flags [P.], seq 45156:45360, ack 1, win 501, options [nop,nop,TS val 2498773184 ecr 1228093410], length 204
01:43:12.359048 IP 147.182.157.116.22 > 72.141.88.185.50292: Flags [P.], seq 45360:45564, ack 1, win 501, options [nop,nop,TS val 2498773184 ecr 1228093410], length 204
01:43:12.359119 IP 147.182.157.116.22 > 72.141.88.185.50292: Flags [P.], seq 45564:45768, ack 1, win 501, options [nop,nop,TS val 2498773184 ecr 1228093410], length 204
01:43:12.359182 IP 147.182.157.116.22 > 72.141.88.185.50292: Flags [P.], seq 45768:45972, ack 1, win 501, options [nop,nop,TS val 2498773185 ecr 1228093410], length 204
01:43:12.359242 IP 147.182.157.116.22 > 72.141.88.185.50292: Flags [P.], seq 45972:46176, ack 1, win 501, options [nop,nop,TS val 2498773185 ecr 1228093410], length 204
01:43:12.359304 IP 147.182.157.116.22 > 72.141.88.185.50292: Flags [P.], seq 46176:46380, ack 1, win 501, options [nop,nop,TS val 2498773185 ecr 1228093410], length 204
01:43:12.359373 IP 147.182.157.116.22 > 72.141.88.185.50292: Flags [P.], seq 46380:46584, ack 1, win 501, options [nop,nop,TS val 2498773185 ecr 1228093410], length 204
01:43:12.359454 IP 147.182.157.116.22 > 72.141.88.185.50292: Flags [P.], seq 46584:46788, ack 1, win 501, options [nop,nop,TS val 2498773185 ecr 1228093410], length 204
01:43:12.359518 IP 147.182.157.116.22 > 72.141.88.185.50292: Flags [P.], seq 46788:46992, ack 1, win 501, options [nop,nop,TS val 2498773185 ecr 1228093410], length 204
01:43:12.359581 IP 147.182.157.116.22 > 72.141.88.185.50292: Flags [P.], seq 46992:47196, ack 1, win 501, options [nop,nop,TS val 2498773185 ecr 1228093410], length 204
01:43:12.359644 IP 147.182.157.116.22 > 72.141.88.185.50292: Flags [P.], seq 47196:47400, ack 1, win 501, options [nop,nop,TS val 2498773185 ecr 1228093410], length 204
01:43:12.359707 IP 147.182.157.116.22 > 72.141.88.185.50292: Flags [P.], seq 47400:47604, ack 1, win 501, options [nop,nop,TS val 2498773185 ecr 1228093410], length 204
01:43:12.359767 IP 147.182.157.116.22 > 72.141.88.185.50292: Flags [P.], seq 47604:47808, ack 1, win 501, options [nop,nop,TS val 2498773185 ecr 1228093410], length 204
01:43:12.359831 IP 147.182.157.116.22 > 72.141.88.185.50292: Flags [P.], seq 47808:48012, ack 1, win 501, options [nop,nop,TS val 2498773185 ecr 1228093410], length 204
01:43:12.359894 IP 147.182.157.116.22 > 72.141.88.185.50292: Flags [P.], seq 48012:48216, ack 1, win 501, options [nop,nop,TS val 2498773185 ecr 1228093410], length 204
01:43:12.359956 IP 147.182.157.116.22 > 72.141.88.185.50292: Flags [P.], seq 48216:48420, ack 1, win 501, options [nop,nop,TS val 2498773185 ecr 1228093410], length 204
01:43:12.360018 IP 147.182.157.116.22 > 72.141.88.185.50292: Flags [P.], seq 48420:48624, ack 1, win 501, options [nop,nop,TS val 2498773185 ecr 1228093410], length 204
01:43:12.360104 IP 147.182.157.116.22 > 72.141.88.185.50292: Flags [P.], seq 48624:48828, ack 1, win 501, options [nop,nop,TS val 2498773185 ecr 1228093410], length 204
01:43:12.360169 IP 147.182.157.116.22 > 72.141.88.185.50292: Flags [P.], seq 48828:49032, ack 1, win 501, options [nop,nop,TS val 2498773186 ecr 1228093410], length 204
01:43:12.360230 IP 147.182.157.116.22 > 72.141.88.185.50292: Flags [P.], seq 49032:49236, ack 1, win 501, options [nop,nop,TS val 2498773186 ecr 1228093410], length 204
01:43:12.360291 IP 147.182.157.116.22 > 72.141.88.185.50292: Flags [P.], seq 49236:49440, ack 1, win 501, options [nop,nop,TS val 2498773186 ecr 1228093410], length 204
01:43:12.360353 IP 147.182.157.116.22 > 72.141.88.185.50292: Flags [P.], seq 49440:49644, ack 1, win 501, options [nop,nop,TS val 2498773186 ecr 1228093410], length 204
01:43:12.360415 IP 147.182.157.116.22 > 72.141.88.185.50292: Flags [P.], seq 49644:49848, ack 1, win 501, options [nop,nop,TS val 2498773186 ecr 1228093410], length 204
01:43:12.360475 IP 147.182.157.116.22 > 72.141.88.185.50292: Flags [P.], seq 49848:50052, ack 1, win 501, options [nop,nop,TS val 2498773186 ecr 1228093410], length 204
01:43:12.360535 IP 147.182.157.116.22 > 72.141.88.185.50292: Flags [P.], seq 50052:50256, ack 1, win 501, options [nop,nop,TS val 2498773186 ecr 1228093410], length 204
01:43:12.360596 IP 147.182.157.116.22 > 72.141.88.185.50292: Flags [P.], seq 50256:50460, ack 1, win 501, options [nop,nop,TS val 2498773186 ecr 1228093410], length 204
01:43:12.360658 IP 147.182.157.116.22 > 72.141.88.185.50292: Flags [P.], seq 50460:50664, ack 1, win 501, options [nop,nop,TS val 2498773186 ecr 1228093410], length 204
01:43:12.360744 IP 147.182.157.116.22 > 72.141.88.185.50292: Flags [P.], seq 50664:50868, ack 1, win 501, options [nop,nop,TS val 2498773186 ecr 1228093410], length 204
