root@comp3134-intro:~# tcpdump -i eth0 tcp
tcpdump: verbose output suppressed, use -v or -vv for full protocol decode
listening on eth0, link-type EN10MB (Ethernet), capture size 262144 bytes
01:43:49.162733 IP comp3134-intro.ssh > cpe688f2e0f3fd3-cm688f2e0f3fd0.cpe.net.fido.ca.50292: Flags [P.], seq 2415112331:2415112367, ack 1407553289, win 1393, options [nop,nop,TS val 2498809988 ecr 1228129304], length 36
01:43:49.164968 IP comp3134-intro.ssh > cpe688f2e0f3fd3-cm688f2e0f3fd0.cpe.net.fido.ca.50292: Flags [P.], seq 36:144, ack 1, win 1393, options [nop,nop,TS val 2498809990 ecr 1228129304], length 108
01:43:49.165049 IP comp3134-intro.ssh > cpe688f2e0f3fd3-cm688f2e0f3fd0.cpe.net.fido.ca.50292: Flags [P.], seq 144:180, ack 1, win 1393, options [nop,nop,TS val 2498809990 ecr 1228129304], length 36
01:43:49.165120 IP comp3134-intro.ssh > cpe688f2e0f3fd3-cm688f2e0f3fd0.cpe.net.fido.ca.50292: Flags [P.], seq 180:288, ack 1, win 1393, options [nop,nop,TS val 2498809990 ecr 1228129304], length 108
01:43:49.165175 IP comp3134-intro.ssh > cpe688f2e0f3fd3-cm688f2e0f3fd0.cpe.net.fido.ca.50292: Flags [P.], seq 288:324, ack 1, win 1393, options [nop,nop,TS val 2498809991 ecr 1228129304], length 36
01:43:49.168440 IP comp3134-intro.ssh > cpe688f2e0f3fd3-cm688f2e0f3fd0.cpe.net.fido.ca.50292: Flags [P.], seq 324:584, ack 1, win 1393, options [nop,nop,TS val 2498809994 ecr 1228129304], length 260
01:43:49.168514 IP comp3134-intro.ssh > cpe688f2e0f3fd3-cm688f2e0f3fd0.cpe.net.fido.ca.50292: Flags [P.], seq 584:620, ack 1, win 1393, options [nop,nop,TS val 2498809994 ecr 1228129304], length 36
01:43:49.168601 IP comp3134-intro.ssh > cpe688f2e0f3fd3-cm688f2e0f3fd0.cpe.net.fido.ca.50292: Flags [P.], seq 620:856, ack 1, win 1393, options [nop,nop,TS val 2498809994 ecr 1228129304], length 236
01:43:49.168664 IP comp3134-intro.ssh > cpe688f2e0f3fd3-cm688f2e0f3fd0.cpe.net.fido.ca.50292: Flags [P.], seq 856:892, ack 1, win 1393, options [nop,nop,TS val 2498809994 ecr 1228129304], length 36
01:43:49.168743 IP comp3134-intro.ssh > cpe688f2e0f3fd3-cm688f2e0f3fd0.cpe.net.fido.ca.50292: Flags [P.], seq 892:1128, ack 1, win 1393, options [nop,nop,TS val 2498809994 ecr 1228129304], length 236
01:43:49.177868 IP cpe688f2e0f3fd3-cm688f2e0f3fd0.cpe.net.fido.ca.50292 > comp3134-intro.ssh: Flags [.], ack 36, win 32767, options [nop,nop,TS val 1228129335 ecr 2498809988], length 0
01:43:49.177913 IP comp3134-intro.ssh > cpe688f2e0f3fd3-cm688f2e0f3fd0.cpe.net.fido.ca.50292: Flags [P.], seq 1128:3068, ack 1, win 1393, options [nop,nop,TS val 2498810003 ecr 1228129335], length 1940
01:43:49.185543 IP cpe688f2e0f3fd3-cm688f2e0f3fd0.cpe.net.fido.ca.50292 > comp3134-intro.ssh: Flags [.], ack 144, win 32766, options [nop,nop,TS val 1228129337 ecr 2498809990], length 0
01:43:49.185543 IP cpe688f2e0f3fd3-cm688f2e0f3fd0.cpe.net.fido.ca.50292 > comp3134-intro.ssh: Flags [.], ack 324, win 32765, options [nop,nop,TS val 1228129339 ecr 2498809991], length 0
01:43:49.185601 IP comp3134-intro.ssh > cpe688f2e0f3fd3-cm688f2e0f3fd0.cpe.net.fido.ca.50292: Flags [P.], seq 3068:3596, ack 1, win 1393, options [nop,nop,TS val 2498810011 ecr 1228129337], length 528
01:43:49.185746 IP comp3134-intro.ssh > cpe688f2e0f3fd3-cm688f2e0f3fd0.cpe.net.fido.ca.50292: Flags [P.], seq 3596:3816, ack 1, win 1393, options [nop,nop,TS val 2498810011 ecr 1228129339], length 220
01:43:49.185807 IP comp3134-intro.ssh > cpe688f2e0f3fd3-cm688f2e0f3fd0.cpe.net.fido.ca.50292: Flags [P.], seq 3816:3852, ack 1, win 1393, options [nop,nop,TS val 2498810011 ecr 1228129339], length 36
01:43:49.185873 IP comp3134-intro.ssh > cpe688f2e0f3fd3-cm688f2e0f3fd0.cpe.net.fido.ca.50292: Flags [P.], seq 3852:4072, ack 1, win 1393, options [nop,nop,TS val 2498810011 ecr 1228129339], length 220
01:43:49.185920 IP comp3134-intro.ssh > cpe688f2e0f3fd3-cm688f2e0f3fd0.cpe.net.fido.ca.50292: Flags [P.], seq 4072:4108, ack 1, win 1393, options [nop,nop,TS val 2498810011 ecr 1228129339], length 36
01:43:49.185990 IP comp3134-intro.ssh > cpe688f2e0f3fd3-cm688f2e0f3fd0.cpe.net.fido.ca.50292: Flags [P.], seq 4108:4344, ack 1, win 1393, options [nop,nop,TS val 2498810011 ecr 1228129339], length 236
01:43:49.186030 IP comp3134-intro.ssh > cpe688f2e0f3fd3-cm688f2e0f3fd0.cpe.net.fido.ca.50292: Flags [P.], seq 4344:4380, ack 1, win 1393, options [nop,nop,TS val 2498810011 ecr 1228129339], length 36
01:43:49.186081 IP comp3134-intro.ssh > cpe688f2e0f3fd3-cm688f2e0f3fd0.cpe.net.fido.ca.50292: Flags [P.], seq 4380:4616, ack 1, win 1393, options [nop,nop,TS val 2498810011 ecr 1228129339], length 236
01:43:49.193044 IP cpe688f2e0f3fd3-cm688f2e0f3fd0.cpe.net.fido.ca.50292 > comp3134-intro.ssh: Flags [.], ack 584, win 32763, options [nop,nop,TS val 1228129341 ecr 2498809994], length 0
01:43:49.193044 IP cpe688f2e0f3fd3-cm688f2e0f3fd0.cpe.net.fido.ca.50292 > comp3134-intro.ssh: Flags [.], ack 620, win 32763, options [nop,nop,TS val 1228129341 ecr 2498809994], length 0
01:43:49.193088 IP comp3134-intro.ssh > cpe688f2e0f3fd3-cm688f2e0f3fd0.cpe.net.fido.ca.50292: Flags [P.], seq 4616:6284, ack 1, win 1393, options [nop,nop,TS val 2498810018 ecr 1228129341], length 1668
01:43:49.193248 IP comp3134-intro.ssh > cpe688f2e0f3fd3-cm688f2e0f3fd0.cpe.net.fido.ca.50292: Flags [P.], seq 6284:6504, ack 1, win 1393, options [nop,nop,TS val 2498810019 ecr 1228129341], length 220
01:43:49.193297 IP comp3134-intro.ssh > cpe688f2e0f3fd3-cm688f2e0f3fd0.cpe.net.fido.ca.50292: Flags [P.], seq 6504:6540, ack 1, win 1393, options [nop,nop,TS val 2498810019 ecr 1228129341], length 36
01:43:49.245258 IP comp3134-intro.ssh > cpe688f2e0f3fd3-cm688f2e0f3fd0.cpe.net.fido.ca.50292: Flags [P.], seq 6540:7612, ack 1, win 1393, options [nop,nop,TS val 2498810071 ecr 1228129341], length 1072
01:43:49.322228 IP cpe688f2e0f3fd3-cm688f2e0f3fd0.cpe.net.fido.ca.50292 > comp3134-intro.ssh: Flags [.], ack 3816, win 32718, options [nop,nop,TS val 1228129476 ecr 2498810011], length 0
01:43:49.322228 IP cpe688f2e0f3fd3-cm688f2e0f3fd0.cpe.net.fido.ca.50292 > comp3134-intro.ssh: Flags [.], ack 3816, win 32768, options [nop,nop,TS val 1228129476 ecr 2498810011], length 0
01:43:49.322317 IP comp3134-intro.ssh > cpe688f2e0f3fd3-cm688f2e0f3fd0.cpe.net.fido.ca.50292: Flags [P.], seq 7612:7884, ack 1, win 1393, options [nop,nop,TS val 2498810148 ecr 1228129476], length 272
01:43:49.322527 IP comp3134-intro.ssh > cpe688f2e0f3fd3-cm688f2e0f3fd0.cpe.net.fido.ca.50292: Flags [P.], seq 7884:8104, ack 1, win 1393, options [nop,nop,TS val 2498810148 ecr 1228129476], length 220
01:43:49.322615 IP comp3134-intro.ssh > cpe688f2e0f3fd3-cm688f2e0f3fd0.cpe.net.fido.ca.50292: Flags [P.], seq 8104:8140, ack 1, win 1393, options [nop,nop,TS val 2498810148 ecr 1228129476], length 36
01:43:49.322705 IP comp3134-intro.ssh > cpe688f2e0f3fd3-cm688f2e0f3fd0.cpe.net.fido.ca.50292: Flags [P.], seq 8140:8360, ack 1, win 1393, options [nop,nop,TS val 2498810148 ecr 1228129476], length 220
01:43:49.322770 IP comp3134-intro.ssh > cpe688f2e0f3fd3-cm688f2e0f3fd0.cpe.net.fido.ca.50292: Flags [P.], seq 8360:8396, ack 1, win 1393, options [nop,nop,TS val 2498810148 ecr 1228129476], length 36
01:43:49.322852 IP comp3134-intro.ssh > cpe688f2e0f3fd3-cm688f2e0f3fd0.cpe.net.fido.ca.50292: Flags [P.], seq 8396:8632, ack 1, win 1393, options [nop,nop,TS val 2498810148 ecr 1228129476], length 236
01:43:49.322923 IP comp3134-intro.ssh > cpe688f2e0f3fd3-cm688f2e0f3fd0.cpe.net.fido.ca.50292: Flags [P.], seq 8632:8668, ack 1, win 1393, options [nop,nop,TS val 2498810148 ecr 1228129476], length 36
01:43:49.322998 IP comp3134-intro.ssh > cpe688f2e0f3fd3-cm688f2e0f3fd0.cpe.net.fido.ca.50292: Flags [P.], seq 8668:8904, ack 1, win 1393, options [nop,nop,TS val 2498810148 ecr 1228129476], length 236
01:43:49.323063 IP comp3134-intro.ssh > cpe688f2e0f3fd3-cm688f2e0f3fd0.cpe.net.fido.ca.50292: Flags [P.], seq 8904:8940, ack 1, win 1393, options [nop,nop,TS val 2498810148 ecr 1228129476], length 36
01:43:49.323145 IP comp3134-intro.ssh > cpe688f2e0f3fd3-cm688f2e0f3fd0.cpe.net.fido.ca.50292: Flags [P.], seq 8940:9176, ack 1, win 1393, options [nop,nop,TS val 2498810149 ecr 1228129476], length 236
01:43:49.323200 IP comp3134-intro.ssh > cpe688f2e0f3fd3-cm688f2e0f3fd0.cpe.net.fido.ca.50292: Flags [P.], seq 9176:9212, ack 1, win 1393, options [nop,nop,TS val 2498810149 ecr 1228129476], length 36
01:43:49.323282 IP comp3134-intro.ssh > cpe688f2e0f3fd3-cm688f2e0f3fd0.cpe.net.fido.ca.50292: Flags [P.], seq 9212:9448, ack 1, win 1393, options [nop,nop,TS val 2498810149 ecr 1228129476], length 236
01:43:49.323334 IP comp3134-intro.ssh > cpe688f2e0f3fd3-cm688f2e0f3fd0.cpe.net.fido.ca.50292: Flags [P.], seq 9448:9484, ack 1, win 1393, options [nop,nop,TS val 2498810149 ecr 1228129476], length 36
01:43:49.328385 IP cpe688f2e0f3fd3-cm688f2e0f3fd0.cpe.net.fido.ca.50292 > comp3134-intro.ssh: Flags [.], ack 4072, win 32764, options [nop,nop,TS val 1228129476 ecr 2498810011], length 0
01:43:49.328385 IP cpe688f2e0f3fd3-cm688f2e0f3fd0.cpe.net.fido.ca.50292 > comp3134-intro.ssh: Flags [.], ack 4108, win 32767, options [nop,nop,TS val 1228129477 ecr 2498810011], length 0
01:43:49.328385 IP cpe688f2e0f3fd3-cm688f2e0f3fd0.cpe.net.fido.ca.50292 > comp3134-intro.ssh: Flags [.], ack 7612, win 32750, options [nop,nop,TS val 1228129477 ecr 2498810071], length 0
01:43:49.328435 IP comp3134-intro.ssh > cpe688f2e0f3fd3-cm688f2e0f3fd0.cpe.net.fido.ca.50292: Flags [P.], seq 9484:11932, ack 1, win 1393, options [nop,nop,TS val 2498810154 ecr 1228129476], length 2448
01:43:49.328561 IP comp3134-intro.ssh > cpe688f2e0f3fd3-cm688f2e0f3fd0.cpe.net.fido.ca.50292: Flags [P.], seq 11932:12152, ack 1, win 1393, options [nop,nop,TS val 2498810154 ecr 1228129477], length 220
01:43:49.328618 IP comp3134-intro.ssh > cpe688f2e0f3fd3-cm688f2e0f3fd0.cpe.net.fido.ca.50292: Flags [P.], seq 12152:12188, ack 1, win 1393, options [nop,nop,TS val 2498810154 ecr 1228129477], length 36
01:43:49.328684 IP comp3134-intro.ssh > cpe688f2e0f3fd3-cm688f2e0f3fd0.cpe.net.fido.ca.50292: Flags [P.], seq 12188:12408, ack 1, win 1393, options [nop,nop,TS val 2498810154 ecr 1228129477], length 220
01:43:49.328744 IP comp3134-intro.ssh > cpe688f2e0f3fd3-cm688f2e0f3fd0.cpe.net.fido.ca.50292: Flags [P.], seq 12408:12444, ack 1, win 1393, options [nop,nop,TS val 2498810154 ecr 1228129477], length 36
01:43:49.328806 IP comp3134-intro.ssh > cpe688f2e0f3fd3-cm688f2e0f3fd0.cpe.net.fido.ca.50292: Flags [P.], seq 12444:12664, ack 1, win 1393, options [nop,nop,TS val 2498810154 ecr 1228129477], length 220
01:43:49.328860 IP comp3134-intro.ssh > cpe688f2e0f3fd3-cm688f2e0f3fd0.cpe.net.fido.ca.50292: Flags [P.], seq 12664:12700, ack 1, win 1393, options [nop,nop,TS val 2498810154 ecr 1228129477], length 36
01:43:49.328941 IP comp3134-intro.ssh > cpe688f2e0f3fd3-cm688f2e0f3fd0.cpe.net.fido.ca.50292: Flags [P.], seq 12700:12936, ack 1, win 1393, options [nop,nop,TS val 2498810154 ecr 1228129477], length 236
01:43:49.328996 IP comp3134-intro.ssh > cpe688f2e0f3fd3-cm688f2e0f3fd0.cpe.net.fido.ca.50292: Flags [P.], seq 12936:12972, ack 1, win 1393, options [nop,nop,TS val 2498810154 ecr 1228129477], length 36
01:43:49.329075 IP comp3134-intro.ssh > cpe688f2e0f3fd3-cm688f2e0f3fd0.cpe.net.fido.ca.50292: Flags [P.], seq 12972:13208, ack 1, win 1393, options [nop,nop,TS val 2498810154 ecr 1228129477], length 236
01:43:49.329138 IP comp3134-intro.ssh > cpe688f2e0f3fd3-cm688f2e0f3fd0.cpe.net.fido.ca.50292: Flags [P.], seq 13208:13244, ack 1, win 1393, options [nop,nop,TS val 2498810155 ecr 1228129477], length 36
01:43:49.329227 IP comp3134-intro.ssh > cpe688f2e0f3fd3-cm688f2e0f3fd0.cpe.net.fido.ca.50292: Flags [P.], seq 13244:13480, ack 1, win 1393, options [nop,nop,TS val 2498810155 ecr 1228129477], length 236
01:43:49.329280 IP comp3134-intro.ssh > cpe688f2e0f3fd3-cm688f2e0f3fd0.cpe.net.fido.ca.50292: Flags [P.], seq 13480:13516, ack 1, win 1393, options [nop,nop,TS val 2498810155 ecr 1228129477], length 36
01:43:49.329348 IP comp3134-intro.ssh > cpe688f2e0f3fd3-cm688f2e0f3fd0.cpe.net.fido.ca.50292: Flags [P.], seq 13516:13752, ack 1, win 1393, options [nop,nop,TS val 2498810155 ecr 1228129477], length 236
01:43:49.329399 IP comp3134-intro.ssh > cpe688f2e0f3fd3-cm688f2e0f3fd0.cpe.net.fido.ca.50292: Flags [P.], seq 13752:13788, ack 1, win 1393, options [nop,nop,TS val 2498810155 ecr 1228129477], length 36
01:43:49.329476 IP comp3134-intro.ssh > cpe688f2e0f3fd3-cm688f2e0f3fd0.cpe.net.fido.ca.50292: Flags [P.], seq 13788:14024, ack 1, win 1393, options [nop,nop,TS val 2498810155 ecr 1228129477], length 236
01:43:49.329532 IP comp3134-intro.ssh > cpe688f2e0f3fd3-cm688f2e0f3fd0.cpe.net.fido.ca.50292: Flags [P.], seq 14024:14060, ack 1, win 1393, options [nop,nop,TS val 2498810155 ecr 1228129477], length 36
01:43:49.329590 IP comp3134-intro.ssh > cpe688f2e0f3fd3-cm688f2e0f3fd0.cpe.net.fido.ca.50292: Flags [P.], seq 14060:14296, ack 1, win 1393, options [nop,nop,TS val 2498810155 ecr 1228129477], length 236
01:43:49.329644 IP comp3134-intro.ssh > cpe688f2e0f3fd3-cm688f2e0f3fd0.cpe.net.fido.ca.50292: Flags [P.], seq 14296:14332, ack 1, win 1393, options [nop,nop,TS val 2498810155 ecr 1228129477], length 36
01:43:49.329713 IP comp3134-intro.ssh > cpe688f2e0f3fd3-cm688f2e0f3fd0.cpe.net.fido.ca.50292: Flags [P.], seq 14332:14568, ack 1, win 1393, options [nop,nop,TS val 2498810155 ecr 1228129477], length 236
01:43:49.329767 IP comp3134-intro.ssh > cpe688f2e0f3fd3-cm688f2e0f3fd0.cpe.net.fido.ca.50292: Flags [P.], seq 14568:14604, ack 1, win 1393, options [nop,nop,TS val 2498810155 ecr 1228129477], length 36
01:43:49.334550 IP cpe688f2e0f3fd3-cm688f2e0f3fd0.cpe.net.fido.ca.50292 > comp3134-intro.ssh: Flags [.], ack 7884, win 32763, options [nop,nop,TS val 1228129488 ecr 2498810148], length 0
01:43:49.334590 IP comp3134-intro.ssh > cpe688f2e0f3fd3-cm688f2e0f3fd0.cpe.net.fido.ca.50292: Flags [P.], seq 14604:17500, ack 1, win 1393, options [nop,nop,TS val 2498810160 ecr 1228129488], length 2896
01:43:49.341592 IP cpe688f2e0f3fd3-cm688f2e0f3fd0.cpe.net.fido.ca.50292 > comp3134-intro.ssh: Flags [.], ack 9176, win 32755, options [nop,nop,TS val 1228129488 ecr 2498810149], length 0
01:43:49.341592 IP cpe688f2e0f3fd3-cm688f2e0f3fd0.cpe.net.fido.ca.50292 > comp3134-intro.ssh: Flags [.], ack 9484, win 32763, options [nop,nop,TS val 1228129491 ecr 2498810149], length 0
01:43:49.341648 IP comp3134-intro.ssh > cpe688f2e0f3fd3-cm688f2e0f3fd0.cpe.net.fido.ca.50292: Flags [P.], seq 17500:18948, ack 1, win 1393, options [nop,nop,TS val 2498810167 ecr 1228129488], length 1448
01:43:49.341806 IP comp3134-intro.ssh > cpe688f2e0f3fd3-cm688f2e0f3fd0.cpe.net.fido.ca.50292: Flags [P.], seq 18948:19168, ack 1, win 1393, options [nop,nop,TS val 2498810167 ecr 1228129491], length 220
01:43:49.341882 IP comp3134-intro.ssh > cpe688f2e0f3fd3-cm688f2e0f3fd0.cpe.net.fido.ca.50292: Flags [P.], seq 19168:19204, ack 1, win 1393, options [nop,nop,TS val 2498810167 ecr 1228129491], length 36
01:43:49.341963 IP comp3134-intro.ssh > cpe688f2e0f3fd3-cm688f2e0f3fd0.cpe.net.fido.ca.50292: Flags [P.], seq 19204:19424, ack 1, win 1393, options [nop,nop,TS val 2498810167 ecr 1228129491], length 220
01:43:49.342024 IP comp3134-intro.ssh > cpe688f2e0f3fd3-cm688f2e0f3fd0.cpe.net.fido.ca.50292: Flags [P.], seq 19424:19460, ack 1, win 1393, options [nop,nop,TS val 2498810167 ecr 1228129491], length 36
01:43:49.342101 IP comp3134-intro.ssh > cpe688f2e0f3fd3-cm688f2e0f3fd0.cpe.net.fido.ca.50292: Flags [P.], seq 19460:19704, ack 1, win 1393, options [nop,nop,TS val 2498810167 ecr 1228129491], length 244
01:43:49.342160 IP comp3134-intro.ssh > cpe688f2e0f3fd3-cm688f2e0f3fd0.cpe.net.fido.ca.50292: Flags [P.], seq 19704:19740, ack 1, win 1393, options [nop,nop,TS val 2498810168 ecr 1228129491], length 36
01:43:49.342235 IP comp3134-intro.ssh > cpe688f2e0f3fd3-cm688f2e0f3fd0.cpe.net.fido.ca.50292: Flags [P.], seq 19740:19976, ack 1, win 1393, options [nop,nop,TS val 2498810168 ecr 1228129491], length 236
01:43:49.342308 IP comp3134-intro.ssh > cpe688f2e0f3fd3-cm688f2e0f3fd0.cpe.net.fido.ca.50292: Flags [P.], seq 19976:20012, ack 1, win 1393, options [nop,nop,TS val 2498810168 ecr 1228129491], length 36
01:43:49.342392 IP comp3134-intro.ssh > cpe688f2e0f3fd3-cm688f2e0f3fd0.cpe.net.fido.ca.50292: Flags [P.], seq 20012:20248, ack 1, win 1393, options [nop,nop,TS val 2498810168 ecr 1228129491], length 236
01:43:49.342451 IP comp3134-intro.ssh > cpe688f2e0f3fd3-cm688f2e0f3fd0.cpe.net.fido.ca.50292: Flags [P.], seq 20248:20284, ack 1, win 1393, options [nop,nop,TS val 2498810168 ecr 1228129491], length 36
01:43:49.342526 IP comp3134-intro.ssh > cpe688f2e0f3fd3-cm688f2e0f3fd0.cpe.net.fido.ca.50292: Flags [P.], seq 20284:20520, ack 1, win 1393, options [nop,nop,TS val 2498810168 ecr 1228129491], length 236
01:43:49.342584 IP comp3134-intro.ssh > cpe688f2e0f3fd3-cm688f2e0f3fd0.cpe.net.fido.ca.50292: Flags [P.], seq 20520:20556, ack 1, win 1393, options [nop,nop,TS val 2498810168 ecr 1228129491], length 36
01:43:49.342657 IP comp3134-intro.ssh > cpe688f2e0f3fd3-cm688f2e0f3fd0.cpe.net.fido.ca.50292: Flags [P.], seq 20556:20792, ack 1, win 1393, options [nop,nop,TS val 2498810168 ecr 1228129491], length 236
01:43:49.342714 IP comp3134-intro.ssh > cpe688f2e0f3fd3-cm688f2e0f3fd0.cpe.net.fido.ca.50292: Flags [P.], seq 20792:20828, ack 1, win 1393, options [nop,nop,TS val 2498810168 ecr 1228129491], length 36
01:43:49.342787 IP comp3134-intro.ssh > cpe688f2e0f3fd3-cm688f2e0f3fd0.cpe.net.fido.ca.50292: Flags [P.], seq 20828:21064, ack 1, win 1393, options [nop,nop,TS val 2498810168 ecr 1228129491], length 236
01:43:49.342844 IP comp3134-intro.ssh > cpe688f2e0f3fd3-cm688f2e0f3fd0.cpe.net.fido.ca.50292: Flags [P.], seq 21064:21100, ack 1, win 1393, options [nop,nop,TS val 2498810168 ecr 1228129491], length 36
01:43:49.342929 IP comp3134-intro.ssh > cpe688f2e0f3fd3-cm688f2e0f3fd0.cpe.net.fido.ca.50292: Flags [P.], seq 21100:21336, ack 1, win 1393, options [nop,nop,TS val 2498810168 ecr 1228129491], length 236
01:43:49.342999 IP comp3134-intro.ssh > cpe688f2e0f3fd3-cm688f2e0f3fd0.cpe.net.fido.ca.50292: Flags [P.], seq 21336:21372, ack 1, win 1393, options [nop,nop,TS val 2498810168 ecr 1228129491], length 36
01:43:49.343071 IP comp3134-intro.ssh > cpe688f2e0f3fd3-cm688f2e0f3fd0.cpe.net.fido.ca.50292: Flags [P.], seq 21372:21608, ack 1, win 1393, options [nop,nop,TS val 2498810168 ecr 1228129491], length 236
01:43:49.343116 IP comp3134-intro.ssh > cpe688f2e0f3fd3-cm688f2e0f3fd0.cpe.net.fido.ca.50292: Flags [P.], seq 21608:21644, ack 1, win 1393, options [nop,nop,TS val 2498810168 ecr 1228129491], length 36
01:43:49.343169 IP comp3134-intro.ssh > cpe688f2e0f3fd3-cm688f2e0f3fd0.cpe.net.fido.ca.50292: Flags [P.], seq 21644:21880, ack 1, win 1393, options [nop,nop,TS val 2498810169 ecr 1228129491], length 236
01:43:49.343211 IP comp3134-intro.ssh > cpe688f2e0f3fd3-cm688f2e0f3fd0.cpe.net.fido.ca.50292: Flags [P.], seq 21880:21916, ack 1, win 1393, options [nop,nop,TS val 2498810169 ecr 1228129491], length 36
01:43:49.343263 IP comp3134-intro.ssh > cpe688f2e0f3fd3-cm688f2e0f3fd0.cpe.net.fido.ca.50292: Flags [P.], seq 21916:22152, ack 1, win 1393, options [nop,nop,TS val 2498810169 ecr 1228129491], length 236
01:43:49.349330 IP cpe688f2e0f3fd3-cm688f2e0f3fd0.cpe.net.fido.ca.50292 > comp3134-intro.ssh: Flags [.], ack 11932, win 32729, options [nop,nop,TS val 1228129495 ecr 2498810154], length 0
01:43:49.349330 IP cpe688f2e0f3fd3-cm688f2e0f3fd0.cpe.net.fido.ca.50292 > comp3134-intro.ssh: Flags [.], ack 13244, win 32750, options [nop,nop,TS val 1228129495 ecr 2498810155], length 0
01:43:49.349330 IP cpe688f2e0f3fd3-cm688f2e0f3fd0.cpe.net.fido.ca.50292 > comp3134-intro.ssh: Flags [.], ack 14604, win 32763, options [nop,nop,TS val 1228129495 ecr 2498810155], length 0
01:43:49.349330 IP cpe688f2e0f3fd3-cm688f2e0f3fd0.cpe.net.fido.ca.50292 > comp3134-intro.ssh: Flags [.], ack 17500, win 32722, options [nop,nop,TS val 1228129499 ecr 2498810160], length 0
01:43:49.349330 IP cpe688f2e0f3fd3-cm688f2e0f3fd0.cpe.net.fido.ca.50292 > comp3134-intro.ssh: Flags [.], ack 17500, win 32768, options [nop,nop,TS val 1228129499 ecr 2498810160], length 0
01:43:49.349388 IP comp3134-intro.ssh > cpe688f2e0f3fd3-cm688f2e0f3fd0.cpe.net.fido.ca.50292: Flags [P.], seq 22152:25048, ack 1, win 1393, options [nop,nop,TS val 2498810175 ecr 1228129495], length 2896
01:43:49.349408 IP comp3134-intro.ssh > cpe688f2e0f3fd3-cm688f2e0f3fd0.cpe.net.fido.ca.50292: Flags [P.], seq 25048:25996, ack 1, win 1393, options [nop,nop,TS val 2498810175 ecr 1228129495], length 948
01:43:49.349569 IP comp3134-intro.ssh > cpe688f2e0f3fd3-cm688f2e0f3fd0.cpe.net.fido.ca.50292: Flags [P.], seq 25996:26224, ack 1, win 1393, options [nop,nop,TS val 2498810175 ecr 1228129499], length 228
01:43:49.349622 IP comp3134-intro.ssh > cpe688f2e0f3fd3-cm688f2e0f3fd0.cpe.net.fido.ca.50292: Flags [P.], seq 26224:26260, ack 1, win 1393, options [nop,nop,TS val 2498810175 ecr 1228129499], length 36
01:43:49.349680 IP comp3134-intro.ssh > cpe688f2e0f3fd3-cm688f2e0f3fd0.cpe.net.fido.ca.50292: Flags [P.], seq 26260:26488, ack 1, win 1393, options [nop,nop,TS val 2498810175 ecr 1228129499], length 228
01:43:49.349722 IP comp3134-intro.ssh > cpe688f2e0f3fd3-cm688f2e0f3fd0.cpe.net.fido.ca.50292: Flags [P.], seq 26488:26524, ack 1, win 1393, options [nop,nop,TS val 2498810175 ecr 1228129499], length 36
01:43:49.349774 IP comp3134-intro.ssh > cpe688f2e0f3fd3-cm688f2e0f3fd0.cpe.net.fido.ca.50292: Flags [P.], seq 26524:26752, ack 1, win 1393, options [nop,nop,TS val 2498810175 ecr 1228129499], length 228
01:43:49.349814 IP comp3134-intro.ssh > cpe688f2e0f3fd3-cm688f2e0f3fd0.cpe.net.fido.ca.50292: Flags [P.], seq 26752:26788, ack 1, win 1393, options [nop,nop,TS val 2498810175 ecr 1228129499], length 36
01:43:49.349876 IP comp3134-intro.ssh > cpe688f2e0f3fd3-cm688f2e0f3fd0.cpe.net.fido.ca.50292: Flags [P.], seq 26788:27016, ack 1, win 1393, options [nop,nop,TS val 2498810175 ecr 1228129499], length 228
01:43:49.349918 IP comp3134-intro.ssh > cpe688f2e0f3fd3-cm688f2e0f3fd0.cpe.net.fido.ca.50292: Flags [P.], seq 27016:27052, ack 1, win 1393, options [nop,nop,TS val 2498810175 ecr 1228129499], length 36
01:43:49.349968 IP comp3134-intro.ssh > cpe688f2e0f3fd3-cm688f2e0f3fd0.cpe.net.fido.ca.50292: Flags [P.], seq 27052:27280, ack 1, win 1393, options [nop,nop,TS val 2498810175 ecr 1228129499], length 228
01:43:49.350008 IP comp3134-intro.ssh > cpe688f2e0f3fd3-cm688f2e0f3fd0.cpe.net.fido.ca.50292: Flags [P.], seq 27280:27316, ack 1, win 1393, options [nop,nop,TS val 2498810175 ecr 1228129499], length 36
01:43:49.350071 IP comp3134-intro.ssh > cpe688f2e0f3fd3-cm688f2e0f3fd0.cpe.net.fido.ca.50292: Flags [P.], seq 27316:27560, ack 1, win 1393, options [nop,nop,TS val 2498810175 ecr 1228129499], length 244
01:43:49.350112 IP comp3134-intro.ssh > cpe688f2e0f3fd3-cm688f2e0f3fd0.cpe.net.fido.ca.50292: Flags [P.], seq 27560:27596, ack 1, win 1393, options [nop,nop,TS val 2498810175 ecr 1228129499], length 36
01:43:49.350163 IP comp3134-intro.ssh > cpe688f2e0f3fd3-cm688f2e0f3fd0.cpe.net.fido.ca.50292: Flags [P.], seq 27596:27832, ack 1, win 1393, options [nop,nop,TS val 2498810176 ecr 1228129499], length 236
01:43:49.350225 IP comp3134-intro.ssh > cpe688f2e0f3fd3-cm688f2e0f3fd0.cpe.net.fido.ca.50292: Flags [P.], seq 27832:28104, ack 1, win 1393, options [nop,nop,TS val 2498810176 ecr 1228129499], length 272
01:43:49.350290 IP comp3134-intro.ssh > cpe688f2e0f3fd3-cm688f2e0f3fd0.cpe.net.fido.ca.50292: Flags [P.], seq 28104:28140, ack 1, win 1393, options [nop,nop,TS val 2498810176 ecr 1228129499], length 36
01:43:49.350342 IP comp3134-intro.ssh > cpe688f2e0f3fd3-cm688f2e0f3fd0.cpe.net.fido.ca.50292: Flags [P.], seq 28140:28376, ack 1, win 1393, options [nop,nop,TS val 2498810176 ecr 1228129499], length 236
01:43:49.350386 IP comp3134-intro.ssh > cpe688f2e0f3fd3-cm688f2e0f3fd0.cpe.net.fido.ca.50292: Flags [P.], seq 28376:28412, ack 1, win 1393, options [nop,nop,TS val 2498810176 ecr 1228129499], length 36
01:43:49.350439 IP comp3134-intro.ssh > cpe688f2e0f3fd3-cm688f2e0f3fd0.cpe.net.fido.ca.50292: Flags [P.], seq 28412:28648, ack 1, win 1393, options [nop,nop,TS val 2498810176 ecr 1228129499], length 236
01:43:49.350479 IP comp3134-intro.ssh > cpe688f2e0f3fd3-cm688f2e0f3fd0.cpe.net.fido.ca.50292: Flags [P.], seq 28648:28684, ack 1, win 1393, options [nop,nop,TS val 2498810176 ecr 1228129499], length 36
01:43:49.350545 IP comp3134-intro.ssh > cpe688f2e0f3fd3-cm688f2e0f3fd0.cpe.net.fido.ca.50292: Flags [P.], seq 28684:28920, ack 1, win 1393, options [nop,nop,TS val 2498810176 ecr 1228129499], length 236
01:43:49.350583 IP comp3134-intro.ssh > cpe688f2e0f3fd3-cm688f2e0f3fd0.cpe.net.fido.ca.50292: Flags [P.], seq 28920:28956, ack 1, win 1393, options [nop,nop,TS val 2498810176 ecr 1228129499], length 36
01:43:49.350635 IP comp3134-intro.ssh > cpe688f2e0f3fd3-cm688f2e0f3fd0.cpe.net.fido.ca.50292: Flags [P.], seq 28956:29192, ack 1, win 1393, options [nop,nop,TS val 2498810176 ecr 1228129499], length 236
01:43:49.350676 IP comp3134-intro.ssh > cpe688f2e0f3fd3-cm688f2e0f3fd0.cpe.net.fido.ca.50292: Flags [P.], seq 29192:29228, ack 1, win 1393, options [nop,nop,TS val 2498810176 ecr 1228129499], length 36
01:43:49.350727 IP comp3134-intro.ssh > cpe688f2e0f3fd3-cm688f2e0f3fd0.cpe.net.fido.ca.50292: Flags [P.], seq 29228:29464, ack 1, win 1393, options [nop,nop,TS val 2498810176 ecr 1228129499], length 236
01:43:49.350769 IP comp3134-intro.ssh > cpe688f2e0f3fd3-cm688f2e0f3fd0.cpe.net.fido.ca.50292: Flags [P.], seq 29464:29500, ack 1, win 1393, options [nop,nop,TS val 2498810176 ecr 1228129499], length 36
01:43:49.350819 IP comp3134-intro.ssh > cpe688f2e0f3fd3-cm688f2e0f3fd0.cpe.net.fido.ca.50292: Flags [P.], seq 29500:29736, ack 1, win 1393, options [nop,nop,TS val 2498810176 ecr 1228129499], length 236
01:43:49.350859 IP comp3134-intro.ssh > cpe688f2e0f3fd3-cm688f2e0f3fd0.cpe.net.fido.ca.50292: Flags [P.], seq 29736:29772, ack 1, win 1393, options [nop,nop,TS val 2498810176 ecr 1228129499], length 36
01:43:49.350909 IP comp3134-intro.ssh > cpe688f2e0f3fd3-cm688f2e0f3fd0.cpe.net.fido.ca.50292: Flags [P.], seq 29772:30008, ack 1, win 1393, options [nop,nop,TS val 2498810176 ecr 1228129499], length 236
01:43:49.350948 IP comp3134-intro.ssh > cpe688f2e0f3fd3-cm688f2e0f3fd0.cpe.net.fido.ca.50292: Flags [P.], seq 30008:30044, ack 1, win 1393, options [nop,nop,TS val 2498810176 ecr 1228129499], length 36
01:43:49.350998 IP comp3134-intro.ssh > cpe688f2e0f3fd3-cm688f2e0f3fd0.cpe.net.fido.ca.50292: Flags [P.], seq 30044:30280, ack 1, win 1393, options [nop,nop,TS val 2498810176 ecr 1228129499], length 236
01:43:49.351040 IP comp3134-intro.ssh > cpe688f2e0f3fd3-cm688f2e0f3fd0.cpe.net.fido.ca.50292: Flags [P.], seq 30280:30316, ack 1, win 1393, options [nop,nop,TS val 2498810176 ecr 1228129499], length 36
01:43:49.351091 IP comp3134-intro.ssh > cpe688f2e0f3fd3-cm688f2e0f3fd0.cpe.net.fido.ca.50292: Flags [P.], seq 30316:30552, ack 1, win 1393, options [nop,nop,TS val 2498810176 ecr 1228129499], length 236
01:43:49.351131 IP comp3134-intro.ssh > cpe688f2e0f3fd3-cm688f2e0f3fd0.cpe.net.fido.ca.50292: Flags [P.], seq 30552:30588, ack 1, win 1393, options [nop,nop,TS val 2498810177 ecr 1228129499], length 36
01:43:49.351193 IP comp3134-intro.ssh > cpe688f2e0f3fd3-cm688f2e0f3fd0.cpe.net.fido.ca.50292: Flags [P.], seq 30588:30824, ack 1, win 1393, options [nop,nop,TS val 2498810177 ecr 1228129499], length 236
01:43:49.351234 IP comp3134-intro.ssh > cpe688f2e0f3fd3-cm688f2e0f3fd0.cpe.net.fido.ca.50292: Flags [P.], seq 30824:30860, ack 1, win 1393, options [nop,nop,TS val 2498810177 ecr 1228129499], length 36
01:43:49.351284 IP comp3134-intro.ssh > cpe688f2e0f3fd3-cm688f2e0f3fd0.cpe.net.fido.ca.50292: Flags [P.], seq 30860:31096, ack 1, win 1393, options [nop,nop,TS val 2498810177 ecr 1228129499], length 236
01:43:49.351326 IP comp3134-intro.ssh > cpe688f2e0f3fd3-cm688f2e0f3fd0.cpe.net.fido.ca.50292: Flags [P.], seq 31096:31132, ack 1, win 1393, options [nop,nop,TS val 2498810177 ecr 1228129499], length 36
01:43:49.351381 IP comp3134-intro.ssh > cpe688f2e0f3fd3-cm688f2e0f3fd0.cpe.net.fido.ca.50292: Flags [P.], seq 31132:31368, ack 1, win 1393, options [nop,nop,TS val 2498810177 ecr 1228129499], length 236
01:43:49.351423 IP comp3134-intro.ssh > cpe688f2e0f3fd3-cm688f2e0f3fd0.cpe.net.fido.ca.50292: Flags [P.], seq 31368:31404, ack 1, win 1393, options [nop,nop,TS val 2498810177 ecr 1228129499], length 36
01:43:49.351475 IP comp3134-intro.ssh > cpe688f2e0f3fd3-cm688f2e0f3fd0.cpe.net.fido.ca.50292: Flags [P.], seq 31404:31640, ack 1, win 1393, options [nop,nop,TS val 2498810177 ecr 1228129499], length 236
01:43:49.351515 IP comp3134-intro.ssh > cpe688f2e0f3fd3-cm688f2e0f3fd0.cpe.net.fido.ca.50292: Flags [P.], seq 31640:31676, ack 1, win 1393, options [nop,nop,TS val 2498810177 ecr 1228129499], length 36
01:43:49.351566 IP comp3134-intro.ssh > cpe688f2e0f3fd3-cm688f2e0f3fd0.cpe.net.fido.ca.50292: Flags [P.], seq 31676:31912, ack 1, win 1393, options [nop,nop,TS val 2498810177 ecr 1228129499], length 236
01:43:49.351607 IP comp3134-intro.ssh > cpe688f2e0f3fd3-cm688f2e0f3fd0.cpe.net.fido.ca.50292: Flags [P.], seq 31912:31948, ack 1, win 1393, options [nop,nop,TS val 2498810177 ecr 1228129499], length 36
01:43:49.351658 IP comp3134-intro.ssh > cpe688f2e0f3fd3-cm688f2e0f3fd0.cpe.net.fido.ca.50292: Flags [P.], seq 31948:32184, ack 1, win 1393, options [nop,nop,TS val 2498810177 ecr 1228129499], length 236
01:43:49.351699 IP comp3134-intro.ssh > cpe688f2e0f3fd3-cm688f2e0f3fd0.cpe.net.fido.ca.50292: Flags [P.], seq 32184:32220, ack 1, win 1393, options [nop,nop,TS val 2498810177 ecr 1228129499], length 36
01:43:49.356731 IP cpe688f2e0f3fd3-cm688f2e0f3fd0.cpe.net.fido.ca.50292 > comp3134-intro.ssh: Flags [.], ack 18948, win 32745, options [nop,nop,TS val 1228129506 ecr 2498810167], length 0
01:43:49.356732 IP cpe688f2e0f3fd3-cm688f2e0f3fd0.cpe.net.fido.ca.50292 > comp3134-intro.ssh: Flags [.], ack 20284, win 32763, options [nop,nop,TS val 1228129506 ecr 2498810168], length 0
01:43:49.356732 IP cpe688f2e0f3fd3-cm688f2e0f3fd0.cpe.net.fido.ca.50292 > comp3134-intro.ssh: Flags [.], ack 21644, win 32741, options [nop,nop,TS val 1228129506 ecr 2498810168], length 0
01:43:49.356732 IP cpe688f2e0f3fd3-cm688f2e0f3fd0.cpe.net.fido.ca.50292 > comp3134-intro.ssh: Flags [.], ack 22152, win 32760, options [nop,nop,TS val 1228129506 ecr 2498810169], length 0
01:43:49.356789 IP comp3134-intro.ssh > cpe688f2e0f3fd3-cm688f2e0f3fd0.cpe.net.fido.ca.50292: Flags [P.], seq 32220:35116, ack 1, win 1393, options [nop,nop,TS val 2498810182 ecr 1228129506], length 2896
01:43:49.356821 IP comp3134-intro.ssh > cpe688f2e0f3fd3-cm688f2e0f3fd0.cpe.net.fido.ca.50292: Flags [P.], seq 35116:38828, ack 1, win 1393, options [nop,nop,TS val 2498810182 ecr 1228129506], length 3712
01:43:49.356960 IP comp3134-intro.ssh > cpe688f2e0f3fd3-cm688f2e0f3fd0.cpe.net.fido.ca.50292: Flags [P.], seq 38828:39056, ack 1, win 1393, options [nop,nop,TS val 2498810182 ecr 1228129506], length 228
01:43:49.357015 IP comp3134-intro.ssh > cpe688f2e0f3fd3-cm688f2e0f3fd0.cpe.net.fido.ca.50292: Flags [P.], seq 39056:39092, ack 1, win 1393, options [nop,nop,TS val 2498810182 ecr 1228129506], length 36
01:43:49.357078 IP comp3134-intro.ssh > cpe688f2e0f3fd3-cm688f2e0f3fd0.cpe.net.fido.ca.50292: Flags [P.], seq 39092:39320, ack 1, win 1393, options [nop,nop,TS val 2498810182 ecr 1228129506], length 228
01:43:49.357147 IP comp3134-intro.ssh > cpe688f2e0f3fd3-cm688f2e0f3fd0.cpe.net.fido.ca.50292: Flags [P.], seq 39320:39584, ack 1, win 1393, options [nop,nop,TS val 2498810183 ecr 1228129506], length 264
01:43:49.357232 IP comp3134-intro.ssh > cpe688f2e0f3fd3-cm688f2e0f3fd0.cpe.net.fido.ca.50292: Flags [P.], seq 39584:39848, ack 1, win 1393, options [nop,nop,TS val 2498810183 ecr 1228129506], length 264
01:43:49.357330 IP comp3134-intro.ssh > cpe688f2e0f3fd3-cm688f2e0f3fd0.cpe.net.fido.ca.50292: Flags [P.], seq 39848:40500, ack 1, win 1393, options [nop,nop,TS val 2498810183 ecr 1228129506], length 652
01:43:49.357437 IP comp3134-intro.ssh > cpe688f2e0f3fd3-cm688f2e0f3fd0.cpe.net.fido.ca.50292: Flags [P.], seq 40500:41552, ack 1, win 1393, options [nop,nop,TS val 2498810183 ecr 1228129506], length 1052
01:43:49.357522 IP comp3134-intro.ssh > cpe688f2e0f3fd3-cm688f2e0f3fd0.cpe.net.fido.ca.50292: Flags [P.], seq 41552:41796, ack 1, win 1393, options [nop,nop,TS val 2498810183 ecr 1228129506], length 244
01:43:49.357583 IP comp3134-intro.ssh > cpe688f2e0f3fd3-cm688f2e0f3fd0.cpe.net.fido.ca.50292: Flags [P.], seq 41796:42040, ack 1, win 1393, options [nop,nop,TS val 2498810183 ecr 1228129506], length 244
01:43:49.357646 IP comp3134-intro.ssh > cpe688f2e0f3fd3-cm688f2e0f3fd0.cpe.net.fido.ca.50292: Flags [P.], seq 42040:42284, ack 1, win 1393, options [nop,nop,TS val 2498810183 ecr 1228129506], length 244
01:43:49.357707 IP comp3134-intro.ssh > cpe688f2e0f3fd3-cm688f2e0f3fd0.cpe.net.fido.ca.50292: Flags [P.], seq 42284:42528, ack 1, win 1393, options [nop,nop,TS val 2498810183 ecr 1228129506], length 244
01:43:49.357768 IP comp3134-intro.ssh > cpe688f2e0f3fd3-cm688f2e0f3fd0.cpe.net.fido.ca.50292: Flags [P.], seq 42528:42772, ack 1, win 1393, options [nop,nop,TS val 2498810183 ecr 1228129506], length 244
01:43:49.357833 IP comp3134-intro.ssh > cpe688f2e0f3fd3-cm688f2e0f3fd0.cpe.net.fido.ca.50292: Flags [P.], seq 42772:43016, ack 1, win 1393, options [nop,nop,TS val 2498810183 ecr 1228129506], length 244
01:43:49.357896 IP comp3134-intro.ssh > cpe688f2e0f3fd3-cm688f2e0f3fd0.cpe.net.fido.ca.50292: Flags [P.], seq 43016:43260, ack 1, win 1393, options [nop,nop,TS val 2498810183 ecr 1228129506], length 244
01:43:49.357956 IP comp3134-intro.ssh > cpe688f2e0f3fd3-cm688f2e0f3fd0.cpe.net.fido.ca.50292: Flags [P.], seq 43260:43504, ack 1, win 1393, options [nop,nop,TS val 2498810183 ecr 1228129506], length 244
01:43:49.358020 IP comp3134-intro.ssh > cpe688f2e0f3fd3-cm688f2e0f3fd0.cpe.net.fido.ca.50292: Flags [P.], seq 43504:43748, ack 1, win 1393, options [nop,nop,TS val 2498810183 ecr 1228129506], length 244
01:43:49.358092 IP comp3134-intro.ssh > cpe688f2e0f3fd3-cm688f2e0f3fd0.cpe.net.fido.ca.50292: Flags [P.], seq 43748:43992, ack 1, win 1393, options [nop,nop,TS val 2498810183 ecr 1228129506], length 244
01:43:49.358154 IP comp3134-intro.ssh > cpe688f2e0f3fd3-cm688f2e0f3fd0.cpe.net.fido.ca.50292: Flags [P.], seq 43992:44236, ack 1, win 1393, options [nop,nop,TS val 2498810184 ecr 1228129506], length 244
01:43:49.358216 IP comp3134-intro.ssh > cpe688f2e0f3fd3-cm688f2e0f3fd0.cpe.net.fido.ca.50292: Flags [P.], seq 44236:44480, ack 1, win 1393, options [nop,nop,TS val 2498810184 ecr 1228129506], length 244
01:43:49.358295 IP comp3134-intro.ssh > cpe688f2e0f3fd3-cm688f2e0f3fd0.cpe.net.fido.ca.50292: Flags [P.], seq 44480:44724, ack 1, win 1393, options [nop,nop,TS val 2498810184 ecr 1228129506], length 244
01:43:49.358360 IP comp3134-intro.ssh > cpe688f2e0f3fd3-cm688f2e0f3fd0.cpe.net.fido.ca.50292: Flags [P.], seq 44724:44968, ack 1, win 1393, options [nop,nop,TS val 2498810184 ecr 1228129506], length 244
01:43:49.358423 IP comp3134-intro.ssh > cpe688f2e0f3fd3-cm688f2e0f3fd0.cpe.net.fido.ca.50292: Flags [P.], seq 44968:45212, ack 1, win 1393, options [nop,nop,TS val 2498810184 ecr 1228129506], length 244
01:43:49.358486 IP comp3134-intro.ssh > cpe688f2e0f3fd3-cm688f2e0f3fd0.cpe.net.fido.ca.50292: Flags [P.], seq 45212:45456, ack 1, win 1393, options [nop,nop,TS val 2498810184 ecr 1228129506], length 244
01:43:49.358548 IP comp3134-intro.ssh > cpe688f2e0f3fd3-cm688f2e0f3fd0.cpe.net.fido.ca.50292: Flags [P.], seq 45456:45700, ack 1, win 1393, options [nop,nop,TS val 2498810184 ecr 1228129506], length 244
01:43:49.358610 IP comp3134-intro.ssh > cpe688f2e0f3fd3-cm688f2e0f3fd0.cpe.net.fido.ca.50292: Flags [P.], seq 45700:45944, ack 1, win 1393, options [nop,nop,TS val 2498810184 ecr 1228129506], length 244
01:43:49.358671 IP comp3134-intro.ssh > cpe688f2e0f3fd3-cm688f2e0f3fd0.cpe.net.fido.ca.50292: Flags [P.], seq 45944:46188, ack 1, win 1393, options [nop,nop,TS val 2498810184 ecr 1228129506], length 244
01:43:49.358730 IP comp3134-intro.ssh > cpe688f2e0f3fd3-cm688f2e0f3fd0.cpe.net.fido.ca.50292: Flags [P.], seq 46188:46432, ack 1, win 1393, options [nop,nop,TS val 2498810184 ecr 1228129506], length 244
01:43:49.358791 IP comp3134-intro.ssh > cpe688f2e0f3fd3-cm688f2e0f3fd0.cpe.net.fido.ca.50292: Flags [P.], seq 46432:46676, ack 1, win 1393, options [nop,nop,TS val 2498810184 ecr 1228129506], length 244
01:43:49.358854 IP comp3134-intro.ssh > cpe688f2e0f3fd3-cm688f2e0f3fd0.cpe.net.fido.ca.50292: Flags [P.], seq 46676:46920, ack 1, win 1393, options [nop,nop,TS val 2498810184 ecr 1228129506], length 244
01:43:49.358921 IP comp3134-intro.ssh > cpe688f2e0f3fd3-cm688f2e0f3fd0.cpe.net.fido.ca.50292: Flags [P.], seq 46920:47164, ack 1, win 1393, options [nop,nop,TS val 2498810184 ecr 1228129506], length 244
01:43:49.359019 IP comp3134-intro.ssh > cpe688f2e0f3fd3-cm688f2e0f3fd0.cpe.net.fido.ca.50292: Flags [P.], seq 47164:47408, ack 1, win 1393, options [nop,nop,TS val 2498810184 ecr 1228129506], length 244
01:43:49.359094 IP comp3134-intro.ssh > cpe688f2e0f3fd3-cm688f2e0f3fd0.cpe.net.fido.ca.50292: Flags [P.], seq 47408:47652, ack 1, win 1393, options [nop,nop,TS val 2498810184 ecr 1228129506], length 244
01:43:49.359157 IP comp3134-intro.ssh > cpe688f2e0f3fd3-cm688f2e0f3fd0.cpe.net.fido.ca.50292: Flags [P.], seq 47652:47896, ack 1, win 1393, options [nop,nop,TS val 2498810185 ecr 1228129506], length 244
01:43:49.359219 IP comp3134-intro.ssh > cpe688f2e0f3fd3-cm688f2e0f3fd0.cpe.net.fido.ca.50292: Flags [P.], seq 47896:48140, ack 1, win 1393, options [nop,nop,TS val 2498810185 ecr 1228129506], length 244
01:43:49.359281 IP comp3134-intro.ssh > cpe688f2e0f3fd3-cm688f2e0f3fd0.cpe.net.fido.ca.50292: Flags [P.], seq 48140:48384, ack 1, win 1393, options [nop,nop,TS val 2498810185 ecr 1228129506], length 244
01:43:49.359341 IP comp3134-intro.ssh > cpe688f2e0f3fd3-cm688f2e0f3fd0.cpe.net.fido.ca.50292: Flags [P.], seq 48384:48628, ack 1, win 1393, options [nop,nop,TS val 2498810185 ecr 1228129506], length 244
01:43:49.359403 IP comp3134-intro.ssh > cpe688f2e0f3fd3-cm688f2e0f3fd0.cpe.net.fido.ca.50292: Flags [P.], seq 48628:48872, ack 1, win 1393, options [nop,nop,TS val 2498810185 ecr 1228129506], length 244
01:43:49.359465 IP comp3134-intro.ssh > cpe688f2e0f3fd3-cm688f2e0f3fd0.cpe.net.fido.ca.50292: Flags [P.], seq 48872:49116, ack 1, win 1393, options [nop,nop,TS val 2498810185 ecr 1228129506], length 244
01:43:49.359527 IP comp3134-intro.ssh > cpe688f2e0f3fd3-cm688f2e0f3fd0.cpe.net.fido.ca.50292: Flags [P.], seq 49116:49360, ack 1, win 1393, options [nop,nop,TS val 2498810185 ecr 1228129506], length 244
01:43:49.359587 IP comp3134-intro.ssh > cpe688f2e0f3fd3-cm688f2e0f3fd0.cpe.net.fido.ca.50292: Flags [P.], seq 49360:49604, ack 1, win 1393, options [nop,nop,TS val 2498810185 ecr 1228129506], length 244
01:43:49.359647 IP comp3134-intro.ssh > cpe688f2e0f3fd3-cm688f2e0f3fd0.cpe.net.fido.ca.50292: Flags [P.], seq 49604:49848, ack 1, win 1393, options [nop,nop,TS val 2498810185 ecr 1228129506], length 244
01:43:49.359708 IP comp3134-intro.ssh > cpe688f2e0f3fd3-cm688f2e0f3fd0.cpe.net.fido.ca.50292: Flags [P.], seq 49848:50092, ack 1, win 1393, options [nop,nop,TS val 2498810185 ecr 1228129506], length 244
01:43:49.359768 IP comp3134-intro.ssh > cpe688f2e0f3fd3-cm688f2e0f3fd0.cpe.net.fido.ca.50292: Flags [P.], seq 50092:50336, ack 1, win 1393, options [nop,nop,TS val 2498810185 ecr 1228129506], length 244
01:43:49.362827 IP cpe688f2e0f3fd3-cm688f2e0f3fd0.cpe.net.fido.ca.50292 > comp3134-intro.ssh: Flags [.], ack 25048, win 32722, options [nop,nop,TS val 1228129514 ecr 2498810175], length 0
01:43:49.362827 IP cpe688f2e0f3fd3-cm688f2e0f3fd0.cpe.net.fido.ca.50292 > comp3134-intro.ssh: Flags [.], ack 27052, win 32736, options [nop,nop,TS val 1228129514 ecr 2498810175], length 0
